f000219,1109.400,1125.200,"The only thing I would say about that is, I think that on the economy, Mr. Bush said for a long time there was no recession, and then said it would be better to do nothing than to have a compromise effort with the Congress."
n000069,1125.200,1126.200,(SILENCE)
f000220,1126.200,1134.800,"He really didn't have a new economic program until over 1300 days into his presidency, and not all of his health care initiative has been presented to the Congress even now."
n000070,1134.800,1135.720,(SILENCE)
f000221,1135.720,1158.000,"I think it's important to elect a president who is committed to getting this economy going again, and who realizes we have to abandon trickle-down economics and put the American people first again, and who will send programs to the Congress in the first hundred days to deal with the critical issues that America is crying out for leadership on -- jobs, incomes, the health care crisis, the need to control the economy."
f000222,1158.000,1160.240,Those things deserve to be dealt with from day one.
f000223,1160.240,1161.920,I will deal with them from day 1.
f000224,1161.920,1165.360,"They will be my first priority, not my election year concern."
n000071,1165.360,1166.400,(SILENCE)
f000225,1166.400,1167.460,Mr. President?
f000226,1167.460,1173.280,"Well, I think you're overlooking that we have had major accomplishments in the first term."
n000072,1173.280,1173.920,(SILENCE)
f000227,1173.920,1183.520,"But if you're talking about protecting the taxpayer against his friends in the US Congress, go back to what it was like when you had a Democratic president and a Democratic Congress."
f000228,1183.520,1185.000,You don't have to go back to Herbert Hoover.
n000073,1185.000,1185.520,(SILENCE)
f000229,1185.520,1192.360,"Go back to Jimmy Carter, and interest rates were 21%, inflation was 15%."
f000230,1192.360,1198.840,The misery index -- unemployment and inflation added together -- it was invented by the Democrats -- went right through the roof.
f000231,1198.840,1200.320,We've cut it in half.
f000232,1200.320,1202.640,And all you hear about is how bad things are.
n000074,1202.640,1203.280,(SILENCE)
f000233,1203.280,1206.640,"You know, remember the question, are you better off?"
n000075,1206.640,1206.960,(SILENCE)
f000234,1206.960,1211.400,"Well, is a homebuyer better off he can refinance the home, because interest rates are down?"
n000076,1211.400,1212.120,(SILENCE)
f000235,1212.120,1219.800,Is the senior citizen better off because inflation is not wiping out their family's savings?
n000077,1219.800,1220.400,(SILENCE)
f000236,1220.400,1221.520,I think they are.
f000237,1221.520,1222.920,Is the guy out of work better off?
f000238,1222.920,1232.440,"Of course he's not, but he's not gonna be better off if we grow the government, if we invest, as Governor Clinton says, invest in more government."
n000078,1232.440,1233.200,(SILENCE)
f000239,1233.200,1235.080,You've got to free up the private sector.
n000079,1235.080,1235.720,(SILENCE)
f000240,1235.720,1238.600,You've got to let small businesses have more incentives.
f000241,1238.600,1249.200,"For 3 months -- quarters I've been fighting, 3 quarters been fighting to get the Congress to pass some incentives for small business."
f000242,1249.200,1254.280,"Capital gains, investment tax allowance, credit for first- time homebuyers."
n000080,1254.280,1254.640,(SILENCE)
f000243,1254.640,1256.400,And it's blocked by the Congress.
f000244,1256.400,1264.280,"And then if a little of it comes my way, they load it up with Christmas trees and tax increases, and I have to stand up and favor the taxpayer."
n000081,1264.280,1265.080,(SILENCE)
f000245,1265.080,1269.360,"I have to -- we have to talk about Ross Perot now or he'll get me, I'm sure."
f000246,1269.360,1289.080,"Mr. Perot, on this issue that I have raised at the very beginning and we've been talking about, which is leadership, as president of the US, it concerns -- my reading of it, at least, my concerns about you, as expressed by folks in the polls and other places, it goes like this."
f000247,1289.080,1290.560,You had a problem with General Motors.
n000082,1290.560,1291.240,(SILENCE)
f000248,1291.240,1293.760,You took your $750 million and you left.
f000249,1293.760,1304.600,You had a problem in the spring and summer about some personal hits that you took as a potential candidate for president of the US and you walked out.
n000083,1304.600,1306.040,(SILENCE)
f000250,1306.040,1311.000,Does that say anything relevant to how you would function as president of the US?
n000084,1311.000,1311.600,(SILENCE)
f000251,1311.600,1313.600,I think the General Motors thing is very relevant.
n000085,1313.600,1314.360,(SILENCE)
f000252,1314.360,1319.280,I did everything I could to get General Motors to face its problems in the mid-'80s while it was still financially strong.
n000086,1319.280,1320.360,(SILENCE)
f000253,1320.360,1331.240,"They just wouldn't do it, and everybody now knows the terrible price they're paying by waiting until it's obvious to the brain-dead that they have problems."
f000254,1331.240,1344.720,"Now, hundreds, thousands of good, decent people, whole cities up here in this state are adversely impacted because they would not move in a timely way."
n000087,1344.720,1345.200,(SILENCE)
f000255,1345.200,1347.360,Our government is that point now.
f000256,1347.360,1356.480,"The thing that I am in this race for is to tap the American people on the shoulder and to say to every single one of you, fix it while we're still relatively strong."
n000088,1356.480,1357.040,(SILENCE)
f000257,1357.040,1360.120,"If you have a heart problem, you don't wait till a heart attack to address it."
n000089,1360.120,1361.160,(SILENCE)
f000258,1361.160,1363.960,So the General Motors experience is relevant.
f000259,1363.960,1378.360,"At the point when I could not get them to address those problems, I had created so much stress in the board, who wanted to just keep the Lawrence Welk music going, that they asked to buy my remaining shares."
f000260,1378.360,1379.920,I sold them my remaining shares.
n000090,1379.920,1380.320,(SILENCE)
f000261,1380.320,1381.160,They went their way.
f000262,1381.160,1386.560,I went my way because it was obvious we had a complete disagreement about what should be done with the company.
f000263,1386.560,1388.160,But let's take my life in perspective.
n000091,1388.160,1389.040,(SILENCE)
f000264,1389.040,1392.720,"Again and again, on complex, difficult tasks, I have stayed the course."
n000092,1392.720,1394.240,(SILENCE)
f000265,1394.240,1404.560,"When I was asked by our government to do the POW project, within a year the Vietnamese had sent people into Canada to make arrangements to have me and my family killed."
n000093,1404.560,1405.400,(SILENCE)
f000266,1405.400,1412.660,"And I had 5 small children, and my family and I decided we would stay the course, and we lived with that problem for 3 years."
f000267,1412.660,1418.480,Then I got into the Texas War on Drugs program and the big-time drug dealers got all upset.
n000094,1418.480,1418.840,(SILENCE)
f000268,1418.840,1423.000,"Then when I had 2 people imprisoned in Iran, I could have left them there."
f000269,1423.000,1424.120,I could have rationalized it.
n000095,1424.120,1424.960,(SILENCE)
f000270,1424.960,1428.280,"We went over, we got them out, we brought them back home."
f000271,1428.280,1439.120,"And since then, for years, I have lived with the burden of the Middle East, where it's eye for an eye and tooth for a tooth country, in terms of their unhappiness with the fact that I was successful in that effort."
n000096,1439.120,1439.880,(SILENCE)
f000272,1439.880,1450.720,"Again and again and again, in the middle of the night, at 2 or 3 o'clock in the morning, my government has called me to take extraordinary steps for Americans in distress, and again and again and again I have responded."
n000097,1450.720,1451.400,(SILENCE)
f000273,1451.400,1453.860,And I didn't wilt and I didn't quit.
f000274,1453.860,1460.000,"Now, what happened in July we've covered again and again and again."
n000098,1460.000,1460.800,(SILENCE)
f000275,1460.800,1472.680,"But I think in terms of the American people's concern about my commitment, I'm here tonight, folks; I never quit supporting you as you put me on the ballot in the other 26 states; and when you asked me to come back in, I came back in."
n000099,1472.680,1473.240,(SILENCE)
f000276,1473.240,1481.520,"And talk about not quitting, I'm spending my money on this campaign; the 2 parties are spending your money, taxpayer money."
f000277,1481.520,1484.040,I put my wallet on the table for you and your children.
n000100,1484.040,1484.680,(SILENCE)
f000278,1484.680,1494.200,"Over $60 million at least will go into this campaign to leave the American dream to you and your children, to get this country straightened out, because if anybody owes it to you, I do."
n000101,1494.200,1494.560,(SILENCE)
f000279,1494.560,1498.080,"I've lived the American dream; I'd like for your children to be able to live it, too."
f000280,1498.080,1498.081,(Laughter)
f000281,1498.081,1506.280,"Governor, do you have a response to the staying- the-course question about Mr. Perot?"
f000282,1506.280,1509.840,I don't have any criticism of Mr. Perot.
f000283,1509.840,1517.800,"I think what I'd like to talk about a minute, since you're asking the question, is the General Motors issue."
f000284,1517.800,1532.880,"I don't think there's any question that the automobile executives made some errors in the 1980s, but I also think we should look at how much productivity has increased lately, how much labor has done to increase productivity and how much management has done."
n000102,1532.880,1533.440,(SILENCE)
f000285,1533.440,1542.880,"And we're still losing a lot of auto jobs, in my judgment, because we don't have a national economic strategy that will build the industrial base of this country."
f000286,1542.880,1548.520,"Just today I met with the presidents and the vice presidents of the Willow Run union here, near here."
n000103,1548.520,1549.040,(SILENCE)
f000287,1549.040,1553.800,They both said they were Vietnam veterans supporting me because I had an economic program to put them back to work.
n000104,1553.800,1554.200,(SILENCE)
f000288,1554.200,1567.960,"We need an investment incentive to modernize plant and equipment; we've got to control the health care costs for those people -- otherwise we can't keep the manufacturing jobs here; and we need a tough trade policy that is fair, that insists on open markets in return for open markets."
f000289,1567.960,1571.340,We ought to have a strategy that will build the economic and industrial base.
f000290,1571.340,1574.840,So I think Mr. Perot was right in questioning the management practices.
f000291,1574.840,1580.880,"But they didn't have much of a partner in government here as compared with the policies the Germans and the Japanese followed, and I believe we can do better."
f000292,1580.880,1583.120,That's one of the things I want to change.
f000293,1583.120,1585.560,I know that we can grow manufacturing jobs.
f000294,1585.560,1587.480,"We did it in my state, and we can do it nationally."
n000105,1587.480,1588.080,(SILENCE)
f000295,1588.080,1589.320,"Mr. President, do you have a response?"
n000106,1589.320,1589.800,(SILENCE)
f000296,1589.800,1590.280,To this?
f000297,1590.280,1590.600,Yes.
n000107,1590.600,1590.960,(SILENCE)
f000298,1590.960,1603.320,"Well, I wondered, when Governor Clinton was talking to the auto workers, whether he talked about his and Senator Gore's favoring CAFE standards, fuel efficiency standards, of 40 miles per gallon."
f000299,1603.320,1607.520,That would break the auto industry and throw a lot of people out of work.
f000300,1607.520,1614.680,"As regarding Mr. Perot, I take back something I said about him."
n000108,1614.680,1615.080,(SILENCE)
f000301,1615.080,1622.280,"I once said, in a frivolous moment, when he got out of the race: If you can't stand the heat, buy an air conditioning company."
f000302,1622.280,1627.000,"And I take it back, because I think -- he said he made a mistake."
f000303,1627.000,1631.160,"And the thing I find is if I make a mistake, I admit it."
n000109,1631.160,1632.040,(SILENCE)
f000304,1632.040,1634.000,I've never heard Governor Clinton make a mistake.
n000110,1634.000,1634.840,(SILENCE)
f000305,1634.840,1645.940,"But one mistake he's made is fuel efficiency standards at 40 to 45 miles a gallon will throw many auto workers out of work, and you can't have it both ways."
f000306,1645.940,1654.720,There's a pattern here of appealing to the auto workers and then trying to appeal to the spotted owl crowds or the extremes in the environmental movement.
f000307,1654.720,1660.840,You can't do it as president: you can't have a pattern of one side of the issue one day and another the next.
f000308,1660.840,1664.840,So my argument is not with Ross Perot; it is more with Governor Clinton.
n000111,1664.840,1665.240,(SILENCE)
f000309,1665.240,1666.640,"Governor, what about that charge?"
n000112,1666.640,1667.560,(SILENCE)
f000310,1667.560,1669.840,Do you want it both ways on this issue?
f000311,1669.840,1673.560,Let's just talk about the CAFE standards -- that's the fuel efficiency standards.
n000113,1673.560,1674.200,(SILENCE)
f000312,1674.200,1680.320,They are now 27.5 miles per gallon per automobile fleet.
f000313,1680.320,1690.860,"I never said -- and I defy you to find where I said -- I gave an extensive environmental speech in April, and I said that we ought to have a goal of raising the fuel efficiency standards to 40 miles a gallon."
f000314,1690.860,1692.120,I think that should be a goal.
n000114,1692.120,1692.600,(SILENCE)
f000315,1692.600,1697.440,I have never said we should write it into law if there is evidence that that goal cannot be achieved.
n000115,1697.440,1697.880,(SILENCE)
f000316,1697.880,1707.800,The Natl Science Foundation did a study which said it would be difficult for us to reach fuel efficiency standards in excess of 37 miles per gallon by the year 2000.
f000317,1707.800,1710.400,I think we should try to raise the fuel efficiency.
f000318,1710.400,1711.600,And let me say this.
f000319,1711.600,1714.560,"I think we ought to have incentives to do it, I think we ought to push to do it."
f000320,1714.560,1716.780,That doesn't mean we have to write it into the law.
f000321,1716.780,1720.480,"Look, I am a job creator, not a job destroyer."
f000322,1720.480,1725.840,It is the Bush administration that has had no new jobs in the private sector in the last 4 years.
f000323,1725.840,1728.800,"In my state, we're leading the country in private sector job growth."
f000324,1728.800,1731.880,But it is good for America to improve fuel efficiency.
n000116,1731.880,1732.280,(SILENCE)
f000325,1732.280,1736.560,We also ought to convert more vehicles to compressed natural gas.
f000326,1736.560,1737.960,That's another way to improve the environment.
n000117,1737.960,1738.360,(SILENCE)
f000327,1738.360,1742.000,"Mr. Perot, based on your experience at General Motors, where do you come down on this?"
f000328,1742.000,1746.880,"This has been thrown about, back and forth, during this campaign from the very beginning about jobs and CAFE standards."
f000329,1746.880,1748.720,"Well, everybody's nibbling around the edges."
f000330,1748.720,1751.740,"Let's go to the center of the bull's-eye, the core problem."
n000118,1751.740,1752.760,(SILENCE)
f000331,1752.760,1756.200,"And believe me, everybody on the factory floor all over this country knows it."
n000119,1756.200,1757.280,(SILENCE)
f000332,1757.280,1780.060,"You implement that NAFTA, the Mexican trade agreement, where they pay people a dollar an hour, have no health care, no retirement, no pollution controls, et cetera, et cetera, et cetera, and you're going to hear a giant sucking sound of jobs being pulled out of this country right at a time when we need the tax base to pay the debt and pay down the interest on the debt and get our house back in order."
f000333,1780.060,1782.200,We've got to proceed very carefully on that.
n000120,1782.200,1782.920,(SILENCE)
f000334,1782.920,1785.240,"See, there's a lot I don't understand."
f000335,1785.240,1786.560,I do understand business.
f000336,1786.560,1788.160,I do understand creating jobs.
f000337,1788.160,1789.840,I do understand how to make things work.
n000121,1789.840,1792.000,(SILENCE)
f000338,1792.000,1793.320,And I got a long history of doing that.
n000122,1793.320,1794.120,(SILENCE)
f000339,1794.120,1801.120,"Now, if you want to go to the core problem that faces everybody in manufacturing in this country, it's that agreement that's about to be put into practice."
f000340,1801.120,1802.280,It's very simple.
f000341,1802.280,1803.800,Everybody says it'll create jobs.
f000342,1803.800,1805.320,"Yes, it'll create bubble jobs."
f000343,1805.320,1808.200,"Now, you know, watch this -- listen very carefully to this."
f000344,1808.200,1813.320,One-time surge while we build factories and ship machine tools and equipment down there.
n000123,1813.320,1813.680,(SILENCE)
f000345,1813.680,1818.000,"Then year after year for decades, they will have jobs."
n000124,1818.000,1818.320,(SILENCE)
f000346,1818.320,1823.720,"And I finally -- I thought I didn't understand it -- called all the experts, and they said, oh, it'll be disruptive for 12 to 15 years."
f000347,1823.720,1825.440,"We haven't got 12 days, folks."
n000125,1825.440,1826.040,(SILENCE)
f000348,1826.040,1828.260,We cannot lose those jobs.
f000349,1828.260,1833.920,"They were eventually saying, Mexican jobs will eventually come to $7.50 an hour, ours will eventually go down to $7.50 an hour."
f000350,1833.920,1835.720,"Makes you feel real good to hear that, right?"
n000126,1835.720,1836.720,(SILENCE)
f000351,1836.720,1838.080,Let's think it through here.
f000352,1838.080,1839.080,Let's be careful.
f000353,1839.080,1847.880,"I'm for free trade philosophically, but I have studied these trade agreements till the world has gone flat, and we don't have good trade agreements across the world."
f000354,1847.880,1855.360,"I hope we'll have a chance to get into that tonight, because I can get right to the center of the bull's-eye and tell you why we're losing whole industries in this country."
f000355,1855.360,1864.480,"Just for the record, though, Mr. Perot, I take it, then, from your answer, you do not have a position on whether or not enforcing the CAFE standards will cost jobs in the auto industry?"
n000127,1864.480,1865.040,(SILENCE)
f000356,1865.040,1869.680,"Oh, no, it will cost jobs, but that's not -- let me say this."
f000357,1869.680,1872.280,"I'd rather, if you gave me 2 bad choices --"
f000358,1872.280,1872.600,Okay.
n000128,1872.600,1872.960,(SILENCE)
f000359,1872.960,1878.160,"I'd rather have some jobs left here than just see everything head south, see?"
f000360,1878.160,1882.720,"So that means -- in other words, you agree with President Bush; is that right?"
f000361,1882.720,1891.360,"No, I'm saying our principal need now is to stabilize the tax base, which is the job base, and create a growing, dynamic base."
f000362,1891.360,1897.400,"Now please, folks, if you don't hear anything else I say, remember where the -- millions of people at work are our tax base."
n000129,1897.400,1897.720,(SILENCE)
f000363,1897.720,1900.200,"Jim, one quick point."
f000364,1900.200,1906.440,"If you confiscate the Forbes 400 wealth, take it all, you cannot balance the budget this year."
n000130,1906.440,1907.400,(SILENCE)
f000365,1907.400,1911.960,"Kind of gets your head straight about where the taxes, year in and year out, have gotta come from."
f000366,1911.960,1915.080,Millions and millions of people at work.
f000367,1915.080,1916.160,"Yes, sir."
f000368,1916.160,1919.120,I'm caught in the middle on NAFTA.
f000369,1919.120,1924.200,"Ross says, with great conviction, he opposes the North American Free Trade Agreement."
n000131,1924.200,1925.000,(SILENCE)
f000370,1925.000,1927.480,I am for the North American Free Trade Agreement.
n000132,1927.480,1928.000,(SILENCE)
f000371,1928.000,1936.280,"My problem with Governor Clinton, once again, is that one time he's gonna make up his mind, he sees some merit in it, but then he sees a lot of things wrong with it."
f000372,1936.280,1940.880,"Then the other day he says he's for it, however then we've got to pass other legislation."
n000133,1940.880,1942.240,(SILENCE)
f000373,1942.240,1950.720,"When you're president of the US, you cannot have this pattern of saying well, I'm for it but I'm on the other side of it."
n000134,1950.720,1951.040,(SILENCE)
f000374,1951.040,1954.660,And it's true on this and it's true on CAFE.
f000375,1954.660,1961.880,"Look, if Ross were right when we get a free trade agreement with Mexico, why wouldn't they have gone down there now?"
n000135,1961.880,1962.440,(SILENCE)
f000376,1962.440,1965.080,You have a differential in wages right now.
f000377,1965.080,1966.800,I just have an honest philosophical difference.
f000378,1966.800,1970.640,I think free trade is going to expand our job opportunity.
f000379,1970.640,1979.320,"I think it is exports that have saved us when we're in a global slowdown, a connected global slowdown, a recession in some countries."
f000380,1979.320,1987.000,"And it's free trade, fair trade that needs to be our hallmark, and we need more free trade agreements, not fewer."
n000136,1987.000,1987.360,(SILENCE)
f000381,1987.360,1991.880,"Governor, quick answer on trade and I want to go on to something else."
f000382,1991.880,1991.881,(APPLAUSE)
f000383,1991.881,1993.840,I'd like to respond to that.
f000384,1993.840,2000.720,"You know, Mr. Bush was very grateful when I was among the Democrats who said he ought to have the authority to negotiate an agreement with Mexico."
n000137,2000.720,2001.560,(SILENCE)
f000385,2001.560,2012.120,"Neither I nor anybody else, as far a I know, agreed to give him our proxy to say that whatever he did was fine for the workers of this country and for the interests of this country."
n000138,2012.120,2012.680,(SILENCE)
f000386,2012.680,2014.320,I am the one who's in the middle on this.
n000139,2014.320,2014.720,(SILENCE)
f000387,2014.720,2016.400,Mr. Perot says it's a bad deal.
f000388,2016.400,2018.280,Mr. Bush says it's a hunky-dory deal.
n000140,2018.280,2018.920,(SILENCE)
f000389,2018.920,2037.240,"I say on balance it does more good than harm if, if we can get some protection for the environment so that the Mexicans have to follow their own environmental standards, their own labor law standards, and if we have a genuine commitment to reeducate and retrain the American workers who lose their jobs and reinvest in this economy."
f000390,2037.240,2039.200,I have a realistic approach to trade.
f000391,2039.200,2043.240,"I want more trade, and I know there are some good things in that agreement."
f000392,2043.240,2044.920,But it can sure be made better.
n000141,2044.920,2045.320,(SILENCE)
f000393,2045.320,2065.520,"Let me just point out, just today in the Los Angeles Times Clyde Prestowitz, who was one of President Reagan's leading trade advisers and a life-long conservative Republican, endorsed my candidacy because he knows that I'll have a free and fair trade policy, a hard-headed, realistic policy, and not get caught up in rubber-stamping everything the Bush administration did."
f000394,2065.520,2068.000,"If I wanted to do that, why would I run for president, Jim?"
n000142,2068.000,2068.360,(SILENCE)
f000395,2068.360,2071.520,Anybody else can run the middle class down and run the economy in a ditch.
f000396,2071.520,2072.360,I want to change it.
f000397,2072.360,2072.361,(APPLAUSE)
f000398,2072.361,2078.920,We've got about 4 --
f000399,2078.920,2080.320,I think he made my case.
f000400,2080.320,2083.320,"On the one hand, it's a good deal but on the other hand I'd make it better."
f000401,2083.320,2084.920,You can't do that as president.
f000402,2084.920,2093.040,"You can't do it on the war, where he says well, I was with the minority but I guess I would have voted with the majority."
f000403,2093.040,2094.400,This is my point tonight.
n000143,2094.400,2095.280,(SILENCE)
f000404,2095.280,2099.160,We're talking about 2 weeks from now you've gotta decide who's gonna be president.
f000405,2099.160,2106.440,And there is this pattern that has plagued him in the primaries and now about trying to have it both ways on all these issues.
n000144,2106.440,2106.840,(SILENCE)
f000406,2106.840,2107.840,You can't do that.
n000145,2107.840,2108.160,(SILENCE)
f000407,2108.160,2113.920,"And if you make a mistake, say you made a mistake and go on about your business, trying to serve the American people."
f000408,2113.920,2115.120,Right now we heard it.
f000409,2115.120,2116.360,Ross is against it.
f000410,2116.360,2117.200,I am for it.
f000411,2117.200,2127.520,He says on the one hand I am for it and on the other hand I may be against it.
f000412,2127.520,2127.920,The governor -- (APPLAUSE)
f000413,2127.920,2129.280,That's what's wrong with Mr. Bush.
f000414,2129.280,2133.080,"His whole deal is you've gotta be for it or against it, you can't make it better."
f000415,2133.080,2134.400,I believe we can be better.
f000416,2134.400,2142.120,"I think the American people are sick and tired of either/or solutions, people being pushed in the corner, polarized to extremes."
f000417,2142.120,2146.080,I want think they want somebody with common sense who can do what's best for the American people.
f000418,2146.080,2152.080,"And I'd be happy to discuss these other issues, but I can't believe he is accusing me of getting on both sides."
f000419,2152.080,2157.120,He said trickle-down economics was voodoo economics; now he's it's biggest practitioner.
f000420,2157.120,2159.760,(Laughter and applause)  He promised -- he -- you know -- let me just say --
f000421,2159.760,2163.680,But I've always said trickle-down government is bad.
