f000422,2163.680,2166.520,"I could run this string out a long time, but remember this, Jim."
n000146,2166.520,2167.240,(SILENCE)
f000423,2167.240,2177.860,"Those 209 Americans last Thursday night in Richmond told us they wanted us to stop talking about each other and start talking about Americans and their problems and their promise, and I think we ought to get back to that."
f000424,2177.860,2181.800,"I'll be glad to answer any question you have, but this election ought to be about the American people."
f000425,2181.800,2181.801,(APPLAUSE)
f000426,2181.801,2188.040,Mr. Perot.
f000427,2188.040,2190.120,Is there an equal time rule tonight?
f000428,2190.120,2191.000,Yes.
f000429,2191.000,2193.160,Or do you just keep lunging in at will?
n000147,2193.160,2193.800,(SILENCE)
f000430,2193.800,2197.960,"I thought we were going to have equal time, but maybe I just have to interrupt the other 2."
f000431,2197.960,2198.920,Is that the way it works?
f000432,2198.920,2200.520,"No, it's -- Mr. Perot, you're doing fine."
f000433,2200.520,2201.240,Go ahead.
f000434,2201.240,2202.800,"Whatever you want to say, say it."
f000435,2202.800,2207.720,"Now that we've talked all around the problem about free trade, let's go again to the center of the bull's- eye."
f000436,2207.720,2207.960,Wait a minute.
f000437,2207.960,2210.120,I was going to ask -- I thought you wanted to respond to what we're talking about.
f000438,2210.120,2211.520,"I do, I do."
f000439,2211.520,2212.040,All right.
f000440,2212.040,2214.600,"I just want to make -- foreign lobbyists, this whole thing."
n000148,2214.600,2216.320,(SILENCE)
f000441,2216.320,2219.560,Our country has sold out to foreign lobbyists.
f000442,2219.560,2220.720,We don't have free trade.
n000149,2220.720,2221.200,(SILENCE)
f000443,2221.200,2226.560,Both parties have foreign lobbyists on leaves in key roles in their campaigns.
f000444,2226.560,2230.240,"And if there's anything more unwise than that, I don't know what it is."
f000445,2230.240,2232.840,"Every debate I bring this up, and nobody ever addresses it."
f000446,2232.840,2240.520,I would like for them to look you in the eye and tell you why they have people representing foreign countries working on their campaigns.
f000447,2240.520,2249.920,"And you know, you've seen the list, I've seen the list, we won't go into the names, but no wonder they -- if I had those people around me all day every day, telling me it was fair and free, I might believe it."
n000150,2249.920,2250.400,(SILENCE)
f000448,2250.400,2259.440,"But if I look at the facts as a businessman, it's so tilted, the first thing you ought to do is just say, guys, if you like these deals so well, we'll give you the deal you gave us."
n000151,2259.440,2260.360,(SILENCE)
f000449,2260.360,2267.320,"Now, Japanese couldn't unload the cars in this country if they had the same restrictions we had, and on and on and on and on and on."
n000152,2267.320,2267.960,(SILENCE)
f000450,2267.960,2276.040,"I suggest to you that the core problem -- 1 country spent $400 million lobbying in 1988, our country."
n000153,2276.040,2276.640,(SILENCE)
f000451,2276.640,2278.280,And it goes on and on.
f000452,2278.280,2281.280,And you look at a who's who in these campaigns around the 2 candidates.
n000154,2281.280,2281.920,(SILENCE)
f000453,2281.920,2283.320,They're foreign lobbyists taking leaves.
f000454,2283.320,2286.080,What do you think they're going to do when the campaign's over?
f000455,2286.080,2289.600,"Go back to work at 30,000 bucks a month representing some other country."
n000155,2289.600,2290.000,(SILENCE)
f000456,2290.000,2293.200,I don't believe that's in the American people's interest.
f000457,2293.200,2297.120,"I don't have a one of them, and I haven't taken a penny of foreign money, and I never will."
f000458,2297.120,2297.121,(APPLAUSE)
f000459,2297.121,2298.760,"Mr. President, how do you respond to that?"
f000460,2298.760,2301.280,Mr. Perot's made that charge several times.
f000461,2301.280,2307.600,The fact that you have people working in your campaign who are paid foreign lobbyists.
f000462,2307.600,2310.000,Most people that are lobbying are lobbying the Congress.
n000156,2310.000,2310.840,(SILENCE)
f000463,2310.840,2317.280,And I don't think there's anything wrong with an honest person who happens to represent an interest of another country for making his case.
f000464,2317.280,2318.700,That's the American way.
f000465,2318.700,2325.120,And what you're assuming is that that makes the recipient of the lobbying corrupt or the lobbyist himself corrupt.
f000466,2325.120,2327.200,I don't agree with that.
n000157,2327.200,2327.720,(SILENCE)
f000467,2327.720,2336.560,"But if I found somebody that had a conflict of interest that would try to illegally do something as a foreign -- registered lobby, the laws cover this."
f000468,2336.560,2345.660,"I don't know why -- I've never understood quite why Mr. Perot was so upset it, because one of the guys he used to have working for him, I believe, had foreign accounts."
f000469,2345.660,2347.200,"Could be wrong, but I think so."
f000470,2347.200,2350.600,"And as soon as I found it out, he went out the door."
f000471,2350.600,2350.601,(Laughter)
f000472,2350.601,2361.480,Well -- (APPLAUSE)  But I don't -- I think you got to look at the integrity and the honor of the people that are being lobbied and those that are lobbyists.
f000473,2361.480,2365.040,The laws protect the American taxpayer in this regard.
f000474,2365.040,2375.160,"If the laws are violated so much, but to suggest if somebody represents a foreign country on anything, that makes him corrupt or against the taxpayer, I don't agree with that."
f000475,2375.160,2376.080,One quick relevant specific.
n000158,2376.080,2376.720,(SILENCE)
f000476,2376.720,2380.480,"We're getting ready to dismantle the airlines industry in our country, and none of you know it."
f000477,2380.480,2383.040,And I doubt in all candor if the president knows it.
n000159,2383.040,2383.760,(SILENCE)
f000478,2383.760,2393.520,"But this deal that we're doing with BAC and US Air and KLM and Northwest, guess who's on the president's campaign big time: a guy from Northwest."
n000160,2393.520,2394.360,(SILENCE)
f000479,2394.360,2398.240,This deal is terribly destructive to the US airline industry.
n000161,2398.240,2398.600,(SILENCE)
f000480,2398.600,2404.800,One of the largest industries in the world is the travel and tourist business.
f000481,2404.800,2410.600,We won't be making airplanes in this country 10 years from now if we let deals like this go through.
n000162,2410.600,2411.560,(SILENCE)
f000482,2411.560,2416.400,"If the president has any interest tonight, I'll detail it to you; I won't take 10 minutes tonight."
f000483,2416.400,2417.960,All these things take a few minutes.
f000484,2417.960,2420.680,But that's happening as we sit here today.
n000163,2420.680,2421.280,(SILENCE)
f000485,2421.280,2429.520,"We hammerlock the American companies -- American Airlines, Delta -- the last few great we have, because we're trying to do this deal with these 2 European companies."
f000486,2429.520,2434.960,"And never forget, they've got Airbus over there, and it's a government-owned, privately owned, consortium across Europe."
n000164,2434.960,2435.480,(SILENCE)
f000487,2435.480,2437.760,They're dying to get the commercial airline business.
f000488,2437.760,2440.800,Japan is trying to get the commercial airline business.
f000489,2440.800,2446.440,"I don't think there are any villains inside government on this issue, but there's sure a lot of people who don't understand business."
f000490,2446.440,2450.800,And maybe you need somebody up there who understands when you're getting your pocket picked.
f000491,2450.800,2450.801,(APPLAUSE)
f000492,2450.801,2451.040,Jim.
f000493,2451.040,2457.480,"Governor, I'm sorry, but that concludes my time with -- well, you..."
f000494,2457.480,2460.880,"Why, I had a great response to that."
f000495,2460.880,2465.160,"All right, go ahead, quick, quickly."
f000496,2465.160,2466.320,Just very briefly.
n000165,2466.320,2467.320,(SILENCE)
f000497,2467.320,2470.600,I think Ross is right and that we do need some more restrictions on lobbyists.
n000166,2470.600,2471.320,(SILENCE)
f000498,2471.320,2481.240,We ought to make them disclose the people they've given money to when they're testifying before congressional committees; we ought to close the lawyers' loopholes; they ought to have to disclose when they're really lobbying.
f000499,2481.240,2490.080,"And we ought to have to limit -- we ought to have a much longer period of time, about 5 years, between the time when people can leave executive branch offices and then go out and start lobbying for foreign interests."
f000500,2490.080,2490.720,I agree with that.
n000167,2490.720,2491.360,(SILENCE)
f000501,2491.360,2497.680,We've wrecked the airline industry already because of all these leverage buyouts and all these terrible things that have happened to the airline industry.
f000502,2497.680,2499.320,We're going to have a hard time rebuilding it.
n000168,2499.320,2499.720,(SILENCE)
f000503,2499.720,2502.920,But the real thing we got to have is a competitive economic strategy.
f000504,2502.920,2513.080,Look what's happening to McDonnell Douglas; even Boeing is losing market share -- because we let the Europeans spend $25-$40 billion on Airbus without an appropriate competitive response.
f000505,2513.080,2518.680,What I want America to do is to trade more but to compete and win by investing in competitive ways.
f000506,2518.680,2520.200,And we're in real trouble on that.
f000507,2520.200,2520.201,(APPLAUSE)
f000508,2520.201,2524.280,I'm going to be in real trouble if I don't bring out -- it's now time...
f000509,2524.280,2526.720,I promise it's less than 10 seconds.
f000510,2526.720,2527.200,OK.
f000511,2527.200,2533.200,I heard Gov Clinton congratulate us on 1 thing -- first time he said something pleasant about this administration.
n000169,2533.200,2533.720,(SILENCE)
f000512,2533.720,2539.960,"Productivity in this country is up, it is way up -- productivity is up."
n000170,2539.960,2540.280,(SILENCE)
f000513,2540.280,2540.920,And that's a good thing.
f000514,2540.920,2543.320,"There are many good ones, but I was glad he acknowledged that."
f000515,2543.320,2543.800,Thank you.
f000516,2543.800,2545.200,Now we're going to move to the 2nd half...
f000517,2545.200,2546.440,Now give me 1 second...
f000518,2546.440,2547.800,We're going to move to the...
f000519,2547.800,2548.640,I've volunteered.
f000520,2548.640,2553.960,"Now, look, I'm just kind of a, you know, cur dog here; I was put on the ballot by the people, not special interests."
f000521,2553.960,2555.440,So I have to stand up for myself.
f000522,2555.440,2557.360,"Now, Jim, let me get it out."
f000523,2557.360,2566.920,"On the 2nd debate, I offered, since both sides want the enterprise zones and we can't get together, I said I'll take a few days off and go to Washington and hold hands with you and we'll get it done."
n000171,2566.920,2567.280,(SILENCE)
f000524,2567.280,2573.640,"I'll take a few days off and hold hands with you and get this airlines thing straightened, because that's important to this country."
n000172,2573.640,2574.360,(SILENCE)
f000525,2574.360,2578.360,"That's kind of pathetic I have to do it -- and nobody's called me yet to come up, I might mention."
f000526,2578.360,2578.361,(Laughter)
f000527,2578.361,2580.560,"All right, I want to bring in..."
f000528,2580.560,2582.160,"But if they do -- if they do, it's easy to fix."
f000529,2582.160,2586.160,"If you all want the enterprise zones, why don't we pass the dang thing and do it, right?"
f000530,2586.160,2586.600,All right.
f000531,2586.600,2589.640,Now we're going to bring in 3 other journalists to ask questions.
f000532,2589.640,2597.320,"They are Susan Rook of CNN, Gene Gibbons of Reuters and Helen Thomas of United Press Intl."
f000533,2597.320,2599.160,"You thought you'd never get in here, did you?"
f000534,2599.160,2599.360,Uh-uh.
f000535,2599.360,2600.080,Uh-uh.
f000536,2600.080,2600.081,(APPLAUSE)
f000537,2600.081,2612.440,OK we're going to continue on the subject of leadership and the first question goes to Gov Clinton for a 2-minute answer.
f000538,2612.440,2613.680,It will be asked by Helen Thomas.
f000539,2613.680,2614.000,Helen?
n000173,2614.000,2614.360,(SILENCE)
f000540,2614.360,2620.960,"Governor Clinton, your credibility has come into question because of your different responses on the Vietnam draft."
n000174,2620.960,2621.280,(SILENCE)
f000541,2621.280,2629.120,"If you had it to do over again, would you put on the nation's uniform, and if elected, could you in good conscience send someone to war?"
n000175,2629.120,2630.280,(SILENCE)
f000542,2630.280,2633.680,If I had it to do over again I might answer the questions a little better.
f000543,2633.680,2643.480,"You know, I'd been in public life a long time and no one had ever questioned my role and so I was asked a lot of questions about things that happened a long time ago and I don't think I answered them as well as I could have."
n000176,2643.480,2644.400,(SILENCE)
f000544,2644.400,2647.320,"Going back 23 years, I don't know, Helen."
f000545,2647.320,2648.520,I was opposed to the war.
n000177,2648.520,2649.440,(SILENCE)
f000546,2649.440,2650.000,I couldn't help that.
f000547,2650.000,2653.760,"I felt very strongly about it, and I didn't want to go at the time."
f000548,2653.760,2657.600,It's easy to say in retrospect I would have done something differently.
n000178,2657.600,2658.160,(SILENCE)
f000549,2658.160,2665.280,"President Lincoln opposed the war and there were people who said maybe he shouldn't be president, but I think he made us a pretty good president in wartime."
n000179,2665.280,2665.960,(SILENCE)
f000550,2665.960,2675.120,"We've had a lot of other presidents who didn't wear their country's uniform who had to order our young soldiers into battle, including President Wilson and President Roosevelt."
n000180,2675.120,2675.840,(SILENCE)
f000551,2675.840,2678.040,So the answer is I could do that.
f000552,2678.040,2680.880,I wouldn't relish doing it but I wouldn't shrink from it.
n000181,2680.880,2681.880,(SILENCE)
f000553,2681.880,2695.600,"I think that the president has to be prepared to use the power of the nation when our vital interests are threatened, when our treaty commitments are at stake, when we know that something has to be done that is in the national interest, and that is a part of being president."
n000182,2695.600,2696.160,(SILENCE)
f000554,2696.160,2696.640,Could I do it?
n000183,2696.640,2697.000,(SILENCE)
f000555,2697.000,2697.480,"Yes, I could."
n000184,2697.480,2698.480,(SILENCE)
f000556,2698.480,2699.480,A reminder now.
f000557,2699.480,2708.000,"We're back on the St. Louis rules, which means that the governor had his answer and then each of you will have 1 minute to respond."
f000558,2708.000,2709.040,Mr. President.
n000185,2709.040,2709.720,(SILENCE)
f000559,2709.720,2721.440,"Well, I've expressed my heartfelt difference with Governor Clinton on organizing demonstrations while in a foreign land against your country, when young ghetto kids have been drafted and are dying."
n000186,2721.440,2721.920,(SILENCE)
f000560,2721.920,2728.140,My argument with him on -- the question was about the draft -- is that there's this same pattern.
n000187,2728.140,2728.720,(SILENCE)
f000561,2728.720,2734.560,"In New Hampshire Senator Kerrey said you ought to level, you ought to tell the truth about it."
n000188,2734.560,2735.080,(SILENCE)
f000562,2735.080,2738.560,On April 17 he said he'd bring out all the records on the draft.
f000563,2738.560,2740.080,They have not been forthcoming.
n000189,2740.080,2740.480,(SILENCE)
f000564,2740.480,2742.920,He got a deferment or he didn't.
f000565,2742.920,2745.040,He got a notice or he didn't.
f000566,2745.040,2748.120,"And I think it's this pattern that troubles me, more than the draft."
f000567,2748.120,2751.820,"A lot of decent, honorable people felt as he did on the draft."
f000568,2751.820,2753.360,But it's this pattern.
f000569,2753.360,2768.400,"And again, you might be able to make amendments all the time, Governor, but you've got to, as president, you can't be on all these different sides, and you can't have this pattern of saying well, I did this or I didn't, then the facts come out and you change it."
f000570,2768.400,2770.800,That's my big difference with him on the draft.
f000571,2770.800,2772.360,It wasn't failing to serve.
n000190,2772.360,2773.360,(SILENCE)
f000572,2773.360,2774.260,"Your minute is up, sir."
f000573,2774.260,2775.320,"Yes, sir."
f000574,2775.320,2775.920,Helen?
n000191,2775.920,2776.480,(SILENCE)
f000575,2776.480,2777.360,"Mr. Perot, 1 minute."
n000192,2777.360,2778.040,(SILENCE)
f000576,2778.040,2782.440,I've spent my whole adult life very close to the military.
n000193,2782.440,2783.920,(SILENCE)
f000577,2783.920,2787.120,I feel very strongly about the people who go into battle for our country.
n000194,2787.120,2788.320,(SILENCE)
f000578,2788.320,2790.580,"I appreciate their idealism, their sacrifices."
f000579,2790.580,2794.740,Appreciate the sacrifices their families make.
f000580,2794.740,2797.520,That's been displayed again and again in a very tangible way.
n000195,2797.520,2799.680,(SILENCE)
f000581,2799.680,2801.480,I look on this as history.
f000582,2801.480,2810.840,"I don't look on it personally as relevant, and I consider it really a waste of time tonight, when you consider the issues that face our country right now."
n000196,2810.840,2811.840,(SILENCE)
f000583,2811.840,2812.080,All right.
f000584,2812.080,2815.600,The next question goes to President Bush and Gene Gibbons will ask it.
f000585,2815.600,2817.680,Gene.
f000586,2817.680,2817.681,(APPLAUSE)
f000587,2817.681,2824.960,"Mr. President, you keep saying that you made a mistake in agreeing to a tax increase to get the 1990 budget deal with Congress."
f000588,2824.960,2842.560,"But if you hadn't gotten that deal, you would have either had to get repeal of the Gramm-Rudman Deficit Control Act or cut defense spending drastically at a time when the country was building up for the gulf war, and decimate domestic discretionary spending, including such things as air traffic control."
n000197,2842.560,2843.400,(SILENCE)
f000589,2843.400,2847.160,"If you had it to do all over again, sir, which of those alternatives would you choose?"
n000198,2847.160,2847.520,(SILENCE)
f000590,2847.520,2850.320,I wouldn't have taken any of the alternatives.
f000591,2850.320,2853.080,I believe that -- I believe I made a mistake.
f000592,2853.080,2855.120,I did it for the very reasons you say.
f000593,2855.120,2860.960,"There was one good thing that came out of that budget agreement, and that is we put a cap on discretionary spending."
n000199,2860.960,2861.320,(SILENCE)
f000594,2861.320,2869.440,"One-third of the president's budget is at the president's discretion, or really the Congress, since they appropriate every dime and tell a president how to spend every dime."
n000200,2869.440,2869.840,(SILENCE)
f000595,2869.840,2875.280,"We've put a cap on the growth of all that spending, and that's good and that's helped."
n000201,2875.280,2876.040,(SILENCE)
f000596,2876.040,2884.280,"But I was wrong because I thought the tax compromise, going along with 1 Democratic tax increase, would help the economy."
n000202,2884.280,2884.680,(SILENCE)
f000597,2884.680,2886.760,I see no evidence that it has done it.
f000598,2886.760,2887.920,So what would I have done?
f000599,2887.920,2889.160,What should I have done?
f000600,2889.160,2897.720,"I should have held out for a better deal that would have protected the taxpayer and not ended up doing what we had to do, or what I thought at the time would help."
f000601,2897.720,2906.880,"So I made a mistake, and I -- you know, the difference, I think, is that I knew at the time I was going to take a lot of political flak."
f000602,2906.880,2912.600,"I knew we'd have somebody out there yelling ""read my lips"", and I did it because I thought it was right."
n000203,2912.600,2913.480,(SILENCE)
f000603,2913.480,2914.320,And I made a mistake.
n000204,2914.320,2915.200,(SILENCE)
f000604,2915.200,2919.720,That's quite different than taking a position where you know it's best for you.
f000605,2919.720,2922.040,That wasn't best for me and I knew it in the very beginning.
n000205,2922.040,2922.640,(SILENCE)
f000606,2922.640,2925.180,I thought it would be better for the country than it was.
f000607,2925.180,2926.400,So there we are.
f000608,2926.400,2926.401,(APPLAUSE)
f000609,2926.401,2935.620,"Mr. Perot, 1 minute."
f000610,2935.620,2938.000,101 in leadership is be accountable for what you do.
n000206,2938.000,2940.640,(SILENCE)
f000611,2940.640,2943.820,Let's go back to the tax and budget summit briefly.
n000207,2943.820,2945.480,(SILENCE)
f000612,2945.480,2950.760,Nobody ever told the American people that we increased spending $1.83 for every dollar of taxes raised.
n000208,2950.760,2951.280,(SILENCE)
f000613,2951.280,2952.800,That's absolutely unconscionable.
f000614,2952.800,2955.600,Both parties carry a huge blame for that on their shoulders.
n000209,2955.600,2956.440,(SILENCE)
f000615,2956.440,2958.200,This was not a way to pay down the deficit.
f000616,2958.200,2959.880,This was a trick on the American people.
f000617,2959.880,2960.880,That's not leadership.
n000210,2960.880,2962.480,(SILENCE)
f000618,2962.480,2966.320,Let's go back in terms of accepting responsibility for your actions.
n000211,2966.320,2967.240,(SILENCE)
f000619,2967.240,2974.920,"If you create Saddam Hussein, over a 10-year period, using billions of dollars of US taxpayer money, step up to the plate and say it was a mistake."
n000212,2974.920,2975.760,(SILENCE)
f000620,2975.760,2981.600,"If you create Noriega, using taxpayer money, step up to the plate and say it was a mistake."
n000213,2981.600,2982.560,(SILENCE)
f000621,2982.560,2998.920,"If you can't get your act together to pick him up one day when a Panamanian major has kidnapped him and a special forces team is 400 yards away and it's a stroll across the park to get him, and if you can't get your act together, at least pick up the Panamanian major, who they then killed, step up to the plate and admit it was a mistake."
f000622,2998.920,2999.960,"That's leadership, folks."
f000623,2999.960,3001.640,"Now, leaders will always make mistakes."
n000214,3001.640,3002.040,(SILENCE)
f000624,3002.040,3008.720,"We've created, and I'm not aiming at any one person here, I'm aiming at our government -- nobody takes responsibility for anything."
n000215,3008.720,3009.320,(SILENCE)
f000625,3009.320,3010.120,We've gotta change that.
n000216,3010.120,3010.480,(SILENCE)
f000626,3010.480,3012.360,I'm taking responsibility for saying your time's up.
f000627,3012.360,3013.860,I'm watching the lights.
f000628,3013.860,3014.440,All right.
f000629,3014.440,3016.320,"Governor Clinton, 1 minute, sir."
n000217,3016.320,3017.800,(SILENCE)
f000630,3017.800,3025.920,"The mistake that was made was making the ""read my lips"" promise in the first place just to get elected, knowing what the size of the deficit was."
f000631,3025.920,3039.240,"(APPLAUSE)  Knowing what the size of the deficit was, knowing there was no plan to control health care costs and knowing that we did not have a strategy to get real economic growth back into this economy."
n000218,3039.240,3040.200,(SILENCE)
f000632,3040.200,3042.920,The choices were not good then.
f000633,3042.920,3049.560,"I think at the time, the mistake that was made was signing off on the deal late on Saturday night in the middle of the night."
f000634,3049.560,3052.120,That's just what the president did when he vetoed the Family Leave Act.
n000219,3052.120,3052.840,(SILENCE)
f000635,3052.840,3058.240,"I think what he should have done is gone before the American people on the front end and said listen, I made a commitment and it was wrong."
n000220,3058.240,3059.240,(SILENCE)
f000636,3059.240,3064.520,I made a mistake because I couldn't have foreseen these circumstances and this is the best deal we can work out at the time.
n000221,3064.520,3065.120,(SILENCE)
f000637,3065.120,3069.880,"He said it was in the public interest at the time and most everybody who was involved in it, I guess, thought it was."
n000222,3069.880,3070.440,(SILENCE)
f000638,3070.440,3073.280,"The real mistake was the ""read my lips"" promise in the first place."
f000639,3073.280,3079.320,You just can't promise something like that just to get elected if you know there's a good chance that circumstances may overtake you.
n000223,3079.320,3079.920,(SILENCE)
f000640,3079.920,3082.200,"All right, Mr. Perot, the question is for you."
f000641,3082.200,3084.600,"You have a 2-minute answer, and it will be asked by Susan Rook."
n000224,3084.600,3085.600,(SILENCE)
f000642,3085.600,3093.200,"Mr. Perot, you've talked about going to Washington to do what the people who run this country want you to do."
n000225,3093.200,3093.560,(SILENCE)
f000643,3093.560,3099.280,"But it is the president's duty to lead, and often lead alone."
f000644,3099.280,3104.140,How can you lead if you are forever seeking consensus before you act?
n000226,3104.140,3104.960,(SILENCE)
f000645,3104.960,3107.440,You're talking about 2 different subjects.
f000646,3107.440,3116.520,"In order to lead, you first have to use the White House as a bully pulpit and lead; then you have to develop consensus or you can't get anything done, and that's where we are now."
f000647,3116.520,3117.640,We can't get anything done.
n000227,3117.640,3118.240,(SILENCE)
f000648,3118.240,3132.000,"How do you get anything done when you've got all of these political action committees, all of these thousands of registered lobbyists -- 40,000 registered lobbyists, 23,000 special interest groups -- and the list goes on and on and on."
