f000223,1239.060,1242.480,"So, once again, go to HillaryClinton.com."
f000224,1242.480,1247.940,We have literally Trump — you can fact check him in real time.
f000225,1247.940,1262.180,"Last time at the first debate, we had millions of people fact checking, so I expect we’ll have millions more fact checking, because, you know, it is — it’s just awfully good that someone with the temperament of Donald Trump is not in charge of the law in our country."
f000226,1262.180,1262.520,Because you’d be in jail.
f000227,1262.520,1262.521,(APPLAUSE)
f000228,1262.521,1263.800,Secretary Clinton...
f000229,1263.800,1274.080,We want to remind the audience to please not talk out loud.
f000230,1274.080,1277.080,Please do not applaud.
f000231,1277.080,1278.480,You’re just wasting time.
f000232,1278.480,1282.440,"And, Secretary Clinton, I do want to follow up on e- mails."
f000233,1282.440,1285.420,You’ve said your handing of your e-mails was a mistake.
f000234,1285.420,1292.960,"You disagreed with FBI Director James Comey, calling your handling of classified information, quote, ""extremely careless."""
n000084,1292.960,1293.360,(SILENCE)
f000235,1293.360,1303.320,"The FBI said that there were 110 classified e-mails that were exchanged, eight of which were top secret, and that it was possible hostile actors did gain access to those e-mails."
f000236,1303.320,1306.740,You don’t call that extremely careless?
f000237,1306.740,1318.340,"Well, Martha, first, let me say — and I’ve said before, but I’ll repeat it, because I want everyone to hear it — that was a mistake, and I take responsibility for using a personal e-mail account."
f000238,1318.340,1321.300,"Obviously, if I were to do it over again, I would not."
f000239,1321.300,1322.960,I’m not making any excuses.
f000240,1322.960,1324.760,It was a mistake.
f000241,1324.760,1327.060,And I am very sorry about that.
f000242,1327.060,1338.120,But I think it’s also important to point out where there are some misleading accusations from critics and others.
f000243,1338.120,1358.000,"After a year-long investigation, there is no evidence that anyone hacked the server I was using and there is no evidence that anyone can point to at all — anyone who says otherwise has no basis — that any classified material ended up in the wrong hands."
f000244,1358.000,1362.560,I take classified materials very seriously and always have.
f000245,1362.560,1367.360,"When I was on the Senate Armed Services Committee, I was privy to a lot of classified material."
n000085,1367.360,1367.840,(SILENCE)
f000246,1367.840,1378.000,"Obviously, as secretary of state, I had some of the most important secrets that we possess, such as going after bin Laden."
f000247,1378.000,1382.980,So I am very committed to taking classified information seriously.
f000248,1382.980,1388.800,"And as I said, there is no evidence that any classified information ended up in the wrong hands."
f000249,1388.800,1389.860,"OK, we’re going to move on."
f000250,1389.860,1394.460,And yet she didn’t know the word — the letter C on a document.
n000086,1394.460,1395.440,(SILENCE)
f000251,1395.440,1395.740,Right?
f000252,1395.740,1399.140,She didn’t even know what that word — what that letter meant.
f000253,1399.140,1400.040,"You know, it’s amazing."
f000254,1400.040,1402.200,I’m watching Hillary go over facts.
n000087,1402.200,1402.840,(SILENCE)
f000255,1402.840,1409.920,"And she’s going after fact after fact, and she’s lying again, because she said she — you know, what she did with the e-mail was fine."
f000256,1409.920,1411.840,"You think it was fine to delete 33,000 e-mails?"
f000257,1411.840,1412.920,I don’t think so.
f000258,1412.920,1419.400,"She said the 33,000 e-mails had to do with her daughter’s wedding, number one, and a yoga class."
f000259,1419.400,1422.760,"Well, maybe we’ll give three or three or four or five or something."
f000260,1422.760,1426.900,"33,000 e-mails deleted, and now she’s saying there wasn’t anything wrong."
f000261,1426.900,1429.460,"And more importantly, that was after getting a subpoena."
f000262,1429.460,1430.380,That wasn’t before.
f000263,1430.380,1431.320,That was after.
f000264,1431.320,1433.280,She got it from the United States Congress.
f000265,1433.280,1442.200,"And I’ll be honest, I am so disappointed in congressmen, including Republicans, for allowing this to happen."
f000266,1442.200,1451.420,"Our Justice Department, where our husband goes on to the back of a airplane for 39 minutes, talks to the attorney general days before a ruling is going to be made on her case."
f000267,1451.420,1461.400,"But for you to say that there was nothing wrong with you deleting 39,000 e-mails, again, you should be ashamed of yourself."
f000268,1461.400,1466.160,What you did — and this is after getting a subpoena from the United States Congress.
f000269,1466.160,1466.720,We have to move on.
f000270,1466.720,1467.240,You did that.
f000271,1467.240,1467.560,Wait a minute.
f000272,1467.560,1468.320,One second.
f000273,1468.320,1470.580,"Secretary Clinton, you can respond, and then we got to move on."
f000274,1470.580,1471.220,We want to give the audience a chance.
f000275,1471.220,1474.880,"If you did that in the private sector, you’d be put in jail, let alone after getting a subpoena from the United States Congress."
f000276,1474.880,1475.780,"Secretary Clinton, you can respond."
f000277,1475.780,1477.240,Then we have to move on to an audience question.
n000088,1477.240,1477.600,(SILENCE)
f000278,1477.600,1479.980,"Look, it’s just not true."
f000279,1479.980,1481.320,"And so please, go to..."
f000280,1481.320,1482.040,"Oh, you didn’t delete them?"
f000281,1482.040,1482.920,"Allow her to respond, please."
f000282,1482.920,1484.600,"It was personal e-mails, not official."
f000283,1484.600,1485.940,"Oh, 33,000?"
f000284,1485.940,1486.320,Yeah.
f000285,1486.320,1488.780,"Not — well, we turned over 35,000, so..."
f000286,1488.780,1489.360,"Oh, yeah."
f000287,1489.360,1491.040,"What about the other 15,000?"
f000288,1491.040,1492.040,Please allow her to respond.
f000289,1492.040,1492.960,She didn’t talk while you talked.
n000089,1492.960,1494.040,(SILENCE)
f000290,1494.040,1494.860,"Yes, that’s true, I didn’t."
f000291,1494.860,1496.020,Because you have nothing to say.
f000292,1496.020,1505.460,"I didn’t in the first debate, and I’m going to try not to in this debate, because I’d like to get to the questions that the people have brought here tonight to talk to us about."
f000293,1505.460,1506.600,Get off this question.
n000090,1506.600,1509.040,(SILENCE)
f000294,1509.040,1509.800,"OK, Donald."
f000295,1509.800,1517.980,"I know you’re into big diversion tonight, anything to avoid talking about your campaign and the way it’s exploding and the way Republicans are leaving you."
f000296,1517.980,1519.320,But let’s at least focus...
f000297,1519.320,1520.280,Let’s see what happens...
f000298,1520.280,1520.281,(CROSSTALK)
f000299,1520.281,1521.600,Allow her to respond.
f000300,1521.600,1523.460,... on some of the issues that people care about tonight.
f000301,1523.460,1524.760,Let’s get to their questions.
f000302,1524.760,1526.760,We have a question here from Ken Karpowicz.
f000303,1526.760,1528.160,He has a question about health care.
n000091,1528.160,1528.560,(SILENCE)
f000304,1528.560,1528.840,Ken?
f000305,1528.840,1531.340,"I’d like to know, Anderson, why aren’t you bringing up the e-mails?"
f000306,1531.340,1532.040,I’d like to know.
f000307,1532.040,1532.760,Why aren’t you bringing...
f000308,1532.760,1533.620,We brought up the e-mails.
f000309,1533.620,1534.220,"No, it hasn’t."
f000310,1534.220,1534.840,It hasn’t.
f000311,1534.840,1536.560,And it hasn’t been finished at all.
n000092,1536.560,1537.000,(SILENCE)
f000312,1537.000,1538.600,Ken Karpowicz has a question.
f000313,1538.600,1539.600,It’s nice to — one on three.
n000093,1539.600,1540.120,(SILENCE)
f000314,1540.120,1540.520,Thank you.
n000094,1540.520,1541.760,(SILENCE)
f000315,1541.760,1547.800,"Affordable Care Act, known as Obamacare, it is not affordable."
f000316,1547.800,1548.760,Premiums have gone up.
n000095,1548.760,1549.240,(SILENCE)
f000317,1549.240,1550.480,Deductibles have gone up.
n000096,1550.480,1551.080,(SILENCE)
f000318,1551.080,1552.160,Copays have gone up.
n000097,1552.160,1552.720,(SILENCE)
f000319,1552.720,1553.760,Prescriptions have gone up.
f000320,1553.760,1555.880,And the coverage has gone down.
n000098,1555.880,1557.000,(SILENCE)
f000321,1557.000,1561.740,What will you do to bring the cost down and make coverage better?
n000099,1561.740,1562.240,(SILENCE)
f000322,1562.240,1566.340,"That first one goes to Secretary Clinton, because you started out the last one to the audience."
n000100,1566.340,1567.040,(SILENCE)
f000323,1567.040,1569.260,"If he wants to start, he can start."
f000324,1569.260,1569.640,"No, go ahead, Donald."
f000325,1569.640,1571.020,"No, I’m a gentlemen, Hillary."
f000326,1571.020,1571.480,Go ahead.
f000327,1571.480,1571.481,(LAUGHTER)
f000328,1571.481,1572.200,Secretary Clinton?
f000329,1572.200,1582.620,"Well, I think Donald was about to say he’s going to solve it by repealing it and getting rid of the Affordable Care Act."
f000330,1582.620,1585.080,"And I’m going to fix it, because I agree with you."
n000101,1585.080,1585.800,(SILENCE)
f000331,1585.800,1587.060,Premiums have gotten too high.
f000332,1587.060,1594.840,"Copays, deductibles, prescription drug costs, and I’ve laid out a series of actions that we can take to try to get those costs down."
n000102,1594.840,1595.560,(SILENCE)
f000333,1595.560,1610.940,"But here’s what I don’t want people to forget when we’re talking about reining in the costs, which has to be the highest priority of the next president, when the Affordable Care Act passed, it wasn’t just that 20 million got insurance who didn’t have it before."
f000334,1610.940,1612.880,But that in and of itself was a good thing.
n000103,1612.880,1613.200,(SILENCE)
f000335,1613.200,1619.360,"I meet these people all the time, and they tell me what a difference having that insurance meant to them and their families."
n000104,1619.360,1620.160,(SILENCE)
f000336,1620.160,1629.680,"But everybody else, the 170 million of us who get health insurance through our employees got big benefits."
f000337,1629.680,1634.640,"Number one, insurance companies can’t deny you coverage because of a pre-existing condition."
n000105,1634.640,1635.560,(SILENCE)
f000338,1635.560,1641.400,"Number two, no lifetime limits, which is a big deal if you have serious health problems."
n000106,1641.400,1641.960,(SILENCE)
f000339,1641.960,1649.120,"Number three, women can’t be charged more than men for our health insurance, which is the way it used to be before the Affordable Care Act."
n000107,1649.120,1649.840,(SILENCE)
f000340,1649.840,1659.640,"Number four, if you’re under 26, and your parents have a policy, you can be on that policy until the age of 26, something that didn’t happen before."
n000108,1659.640,1660.120,(SILENCE)
f000341,1660.120,1666.440,So I want very much to save what works and is good about the Affordable Care Act.
f000342,1666.440,1667.980,But we’ve got to get costs down.
f000343,1667.980,1675.040,We’ve got to provide additional help to small businesses so that they can afford to provide health insurance.
n000109,1675.040,1675.520,(SILENCE)
f000344,1675.520,1688.440,"But if we repeal it, as Donald has proposed, and start over again, all of those benefits I just mentioned are lost to everybody, not just people who get their health insurance on the exchange."
n000110,1688.440,1689.080,(SILENCE)
f000345,1689.080,1691.360,And then we would have to start all over again.
n000111,1691.360,1691.840,(SILENCE)
f000346,1691.840,1695.200,"Right now, we are at 90 percent health insurance coverage."
f000347,1695.200,1696.700,That’s the highest we’ve ever been in our country.
f000348,1696.700,1698.260,"Secretary Clinton, your time is up."
f000349,1698.260,1702.760,"So I want us to get to 100 percent, but get costs down and keep quality up."
n000112,1702.760,1703.080,(SILENCE)
f000350,1703.080,1704.240,"Mr. Trump, you have two minutes."
n000113,1704.240,1705.320,(SILENCE)
f000351,1705.320,1712.000,"It is such a great question and it’s maybe the question I get almost more than anything else, outside of defense."
n000114,1712.000,1713.240,(SILENCE)
f000352,1713.240,1714.680,Obamacare is a disaster.
n000115,1714.680,1715.520,(SILENCE)
f000353,1715.520,1716.280,You know it.
f000354,1716.280,1716.720,We all know it.
n000116,1716.720,1718.120,(SILENCE)
f000355,1718.120,1721.680,It’s going up at numbers that nobody’s ever seen worldwide.
f000356,1721.680,1724.540,Nobody’s ever seen numbers like this for health care.
n000117,1724.540,1725.120,(SILENCE)
f000357,1725.120,1726.200,It’s only getting worse.
f000358,1726.200,1728.480,"In ’17, it implodes by itself."
n000118,1728.480,1729.080,(SILENCE)
f000359,1729.080,1733.440,"Their method of fixing it is to go back and ask Congress for more money, more and more money."
n000119,1733.440,1733.760,(SILENCE)
f000360,1733.760,1737.300,We have right now almost $20 trillion in debt.
f000361,1737.300,1739.000,Obamacare will never work.
n000120,1739.000,1739.680,(SILENCE)
f000362,1739.680,1742.880,"It’s very bad, very bad health insurance."
f000363,1742.880,1744.720,Far too expensive.
f000364,1744.720,1749.600,"And not only expensive for the person that has it, unbelievably expensive for our country."
f000365,1749.600,1753.040,It’s going to be one of the biggest line items very shortly.
f000366,1753.040,1765.480,"We have to repeal it and replace it with something absolutely much less expensive and something that works, where your plan can actually be tailored."
f000367,1765.480,1781.660,"We have to get rid of the lines around the state, artificial lines, where we stop insurance companies from coming in and competing, because they want — and President Obama and whoever was working on it — they want to leave those lines, because that gives the insurance companies essentially monopolies."
f000368,1781.660,1783.040,We want competition.
n000121,1783.040,1783.960,(SILENCE)
f000369,1783.960,1787.200,You will have the finest health care plan there is.
f000370,1787.200,1791.640,"She wants to go to a single-payer plan, which would be a disaster, somewhat similar to Canada."
f000371,1791.640,1801.800,"And if you haven’t noticed the Canadians, when they need a big operation, when something happens, they come into the United States in many cases because their system is so slow."
n000122,1801.800,1802.640,(SILENCE)
f000372,1802.640,1805.400,It’s catastrophic in certain ways.
f000373,1805.400,1810.440,"But she wants to go to single payer, which means the government basically rules everything."
n000123,1810.440,1811.120,(SILENCE)
f000374,1811.120,1813.880,Hillary Clinton has been after this for years.
f000375,1813.880,1815.620,Obamacare was the first step.
n000124,1815.620,1816.080,(SILENCE)
f000376,1816.080,1819.080,Obamacare is a total disaster.
f000377,1819.080,1829.700,"And not only are your rates going up by numbers that nobody’s ever believed, but your deductibles are going up, so that unless you get hit by a truck, you’re never going to be able to use it."
f000378,1829.700,1830.500,"Mr. Trump, your time..."
f000379,1830.500,1834.620,"It is a disastrous plan, and it has to be repealed and replaced."
f000380,1834.620,1836.280,"Secretary Clinton, let me follow up with you."
f000381,1836.280,1844.440,"Your husband called Obamacare, quote, ""the craziest thing in the world,"" saying that small-business owners are getting killed as premiums double, coverage is cut in half."
f000382,1844.440,1846.880,Was he mistaken or was the mistake simply telling the truth?
n000125,1846.880,1847.280,(SILENCE)
f000383,1847.280,1849.220,"No, I mean, he clarified what he meant."
f000384,1849.220,1850.200,And it’s very clear.
f000385,1850.200,1859.060,"Look, we are in a situation in our country where if we were to start all over again, we might come up with a different system."
f000386,1859.060,1860.380,But we have an employer-based system.
f000387,1860.380,1864.400,That’s where the vast majority of people get their health care.
f000388,1864.400,1876.840,"And the Affordable Care Act was meant to try to fill the gap between people who were too poor and couldn’t put together any resources to afford health care, namely people on Medicaid."
n000126,1876.840,1877.440,(SILENCE)
f000389,1877.440,1895.620,"Obviously, Medicare, which is a single-payer system, which takes care of our elderly and does a great job doing it, by the way, and then all of the people who were employed, but people who were working but didn’t have the money to afford insurance and didn’t have anybody, an employer or anybody else, to help them."
f000390,1895.620,1900.520,That was the slot that the Obamacare approach was to take.
f000391,1900.520,1903.960,"And like I say, 20 million people now have health insurance."
f000392,1903.960,1913.660,"So if we just rip it up and throw it away, what Donald’s not telling you is we just turn it back to the insurance companies the way it used to be, and that means the insurance companies..."
f000393,1913.660,1913.800,Secretary Clinton...
f000394,1913.800,1921.580,"... get to do pretty much whatever they want, including saying, look, I’m sorry, you’ve got diabetes, you had cancer, your child has asthma..."
f000395,1921.580,1922.240,Your time is up.
f000396,1922.240,1925.440,... you may not be able to have insurance because you can’t afford it.
f000397,1925.440,1933.120,"So let’s fix what’s broken about it, but let’s not throw it away and give it all back to the insurance companies and the drug companies."
f000398,1933.120,1933.640,That’s not going to work.
f000399,1933.640,1935.480,"Mr. Trump, let me follow up on this."
f000400,1935.480,1936.460,"Well, I just want — just one thing."
f000401,1936.460,1938.380,"First of all, Hillary, everything’s broken about it."
f000402,1938.380,1939.220,Everything.
f000403,1939.220,1943.920,"Number two, Bernie Sanders said that Hillary Clinton has very bad judgment."
f000404,1943.920,1947.920,"This is a perfect example of it, trying to save Obamacare, which is a disaster."
f000405,1947.920,1949.240,You’ve said you want to end Obamacare...
f000406,1949.240,1949.600,By the way...
f000407,1949.600,1951.140,You’ve said you want to end Obamacare.
f000408,1951.140,1955.280,You’ve also said you want to make coverage accessible for people with pre-existing conditions.
f000409,1955.280,1959.980,How do you force insurance companies to do that if you’re no longer mandating that every American get insurance?
f000410,1959.980,1960.200,We’re going to be able to.
f000411,1960.200,1961.040,You’re going to have plans...
f000412,1961.040,1961.760,What does that mean?
f000413,1961.760,1963.020,"Well, I’ll tell you what it means."
n000127,1963.020,1963.480,(SILENCE)
f000414,1963.480,1968.960,"You’re going to have plans that are so good, because we’re going to have so much competition in the insurance industry."
f000415,1968.960,1973.260,Once we break out — once we break out the lines and allow the competition to come...
f000416,1973.260,1977.140,Are you going — are you going to have a mandate that Americans have to have health insurance?
f000417,1977.140,1979.780,"President Obama — Anderson, excuse me."
f000418,1979.780,1989.780,"President Obama, by keeping those lines, the boundary lines around each state, it was almost gone until just very toward the end of the passage of Obamacare, which, by the way, was a fraud."
f000419,1989.780,1997.180,"You know that, because Jonathan Gruber, the architect of Obamacare, was said — he said it was a great lie, it was a big lie."
f000420,1997.180,1999.580,"President Obama said you keep your doctor, you keep your plan."
f000421,1999.580,2002.280,"The whole thing was a fraud, and it doesn’t work."
f000422,2002.280,2014.140,"But when we get rid of those lines, you will have competition, and we will be able to keep pre-existing, we’ll also be able to help people that can’t get — don’t have money because we are going to have people protected."
f000423,2014.140,2017.760,"And Republicans feel this way, believe it or not, and strongly this way."
f000424,2017.760,2020.840,We’re going to block grant into the states.
f000425,2020.840,2023.000,We’re going to block grant into Medicaid into the states...
f000426,2023.000,2024.000,"Thank you, Mr. Trump."
f000427,2024.000,2029.060,... so that we will be able to take care of people without the necessary funds to take care of themselves.
f000428,2029.060,2029.740,"Thank you, Mr. Trump."
n000128,2029.740,2030.400,(SILENCE)
f000429,2030.400,2037.280,We now go to Gorbah Hamed with a question for both candidates.
f000430,2037.280,2037.540,Hi.
f000431,2037.540,2042.420,"There are 3.3 million Muslims in the United States, and I’m one of them."
f000432,2042.420,2052.140,"You’ve mentioned working with Muslim nations, but with Islamophobia on the rise, how will you help people like me deal with the consequences of being labeled as a threat to the country after the election is over?"
f000433,2052.140,2054.960,"Mr. Trump, you’re first."
n000129,2054.960,2055.600,(SILENCE)
f000434,2055.600,2058.720,"Well, you’re right about Islamophobia, and that’s a shame."
n000130,2058.720,2059.200,(SILENCE)
f000435,2059.200,2065.160,But one thing we have to do is we have to make sure that — because there is a problem.
n000131,2065.160,2065.760,(SILENCE)
f000436,2065.760,2071.440,"I mean, whether we like it or not, and we could be very politically correct, but whether we like it or not, there is a problem."
n000132,2071.440,2071.800,(SILENCE)
f000437,2071.800,2077.680,And we have to be sure that Muslims come in and report when they see something going on.
f000438,2077.680,2080.600,"When they see hatred going on, they have to report it."
f000439,2080.600,2088.120,"As an example, in San Bernardino, many people saw the bombs all over the apartment of the two people that killed 14 and wounded many, many people."
n000133,2088.120,2088.600,(SILENCE)
f000440,2088.600,2090.080,Horribly wounded.
f000441,2090.080,2090.760,They’ll never be the same.
n000134,2090.760,2091.640,(SILENCE)
f000442,2091.640,2096.780,Muslims have to report the problems when they see them.
f000443,2096.780,2100.680,"And, you know, there’s always a reason for everything."
n000135,2100.680,2101.200,(SILENCE)
f000444,2101.200,2110.900,"If they don’t do that, it’s a very difficult situation for our country, because you look at Orlando and you look at San Bernardino and you look at the World Trade Center."
f000445,2110.900,2111.560,Go outside.
f000446,2111.560,2112.420,Look at Paris.
f000447,2112.420,2116.400,Look at that horrible — these are radical Islamic terrorists.
n000136,2116.400,2116.960,(SILENCE)
f000448,2116.960,2121.100,And she won’t even mention the word and nor will President Obama.
f000449,2121.100,2124.780,"He won’t use the term ""radical Islamic terrorism."""
f000450,2124.780,2131.760,"Now, to solve a problem, you have to be able to state what the problem is or at least say the name."
f000451,2131.760,2134.900,She won’t say the name and President Obama won’t say the name.
f000452,2134.900,2136.560,But the name is there.
n000137,2136.560,2136.920,(SILENCE)
f000453,2136.920,2139.200,It’s radical Islamic terror.
f000454,2139.200,2141.100,"And before you solve it, you have to say the name."
f000455,2141.100,2143.840,Secretary Clinton?
f000456,2143.840,2147.420,"Well, thank you for asking your question."
f000457,2147.420,2161.840,"And I’ve heard this question from a lot of Muslim-Americans across our country, because, unfortunately, there’s been a lot of very divisive, dark things said about Muslims."
f000458,2161.840,2172.520,"And even someone like Captain Khan, the young man who sacrificed himself defending our country in the United States Army, has been subject to attack by Donald."
n000138,2172.520,2173.640,(SILENCE)
f000459,2173.640,2175.040,I want to say just a couple of things.
f000460,2175.040,2179.480,"First, we’ve had Muslims in America since George Washington."
f000461,2179.480,2182.100,And we’ve had many successful Muslims.
f000462,2182.100,2186.320,We just lost a particular well-known one with Muhammad Ali.
n000139,2186.320,2189.240,(SILENCE)
f000463,2189.240,2199.560,"My vision of America is an America where everyone has a place, if you’re willing to work hard, you do your part, you contribute to the community."
n000140,2199.560,2201.080,(SILENCE)
f000464,2201.080,2202.300,That’s what America is.
f000465,2202.300,2204.700,That’s what we want America to be for our children and our grandchildren.
n000141,2204.700,2206.240,(SILENCE)
f000466,2206.240,2213.960,It’s also very short-sighted and even dangerous to be engaging in the kind of demagogic rhetoric that Donald has about Muslims.
n000142,2213.960,2214.880,(SILENCE)
f000467,2214.880,2219.960,We need American Muslims to be part of our eyes and ears on our front lines.
n000143,2219.960,2220.520,(SILENCE)
f000468,2220.520,2224.160,I’ve worked with a lot of different Muslim groups around America.
n000144,2224.160,2224.520,(SILENCE)
f000469,2224.520,2237.240,"I’ve met with a lot of them, and I’ve heard how important it is for them to feel that they are wanted and included and part of our country, part of our homeland security, and that’s what I want to see."
n000145,2237.240,2237.920,(SILENCE)
f000470,2237.920,2245.160,"It’s also important I intend to defeat ISIS, to do so in a coalition with majority Muslim nations."
n000146,2245.160,2245.800,(SILENCE)
