f000471,2245.800,2252.800,"Right now, a lot of those nations are hearing what Donald says and wondering, why should we cooperate with the Americans?"
f000472,2252.800,2259.120,"And this is a gift to ISIS and the terrorists, violent jihadist terrorists."
n000147,2259.120,2259.480,(SILENCE)
f000473,2259.480,2261.480,We are not at war with Islam.
n000148,2261.480,2262.320,(SILENCE)
f000474,2262.320,2267.360,And it is a mistake and it plays into the hands of the terrorists to act as though we are.
n000149,2267.360,2267.960,(SILENCE)
f000475,2267.960,2275.220,So I want a country where citizens like you and your family are just as welcome as anyone else.
f000476,2275.220,2276.760,"Thank you, Secretary Clinton."
n000150,2276.760,2277.080,(SILENCE)
f000477,2277.080,2278.960,"Mr. Trump, in December, you said this."
n000151,2278.960,2279.680,(SILENCE)
f000478,2279.680,2289.920,"""Donald J. Trump is calling for a total and complete shutdown of Muslims entering the United States until our country’s representatives can figure out what the hell is going on."
n000152,2289.920,2290.360,(SILENCE)
f000479,2290.360,2291.520,We have no choice.
f000480,2291.520,2292.720,"We have no choice."""
n000153,2292.720,2293.240,(SILENCE)
f000481,2293.240,2297.760,Your running mate said this week that the Muslim ban is no longer your position.
f000482,2297.760,2299.000,Is that correct?
n000154,2299.000,2299.560,(SILENCE)
f000483,2299.560,2303.260,"And if it is, was it a mistake to have a religious test?"
f000484,2303.260,2319.940,"First of all, Captain Khan is an American hero, and if I were president at that time, he would be alive today, because unlike her, who voted for the war without knowing what she was doing, I would not have had our people in Iraq."
f000485,2319.940,2321.520,Iraq was disaster.
f000486,2321.520,2324.120,So he would have been alive today.
n000155,2324.120,2325.000,(SILENCE)
f000487,2325.000,2333.580,The Muslim ban is something that in some form has morphed into a extreme vetting from certain areas of the world.
f000488,2333.580,2338.720,Hillary Clinton wants to allow hundreds of thousands — excuse me.
f000489,2338.720,2339.140,Excuse me..
f000490,2339.140,2341.020,And why did it morph into that?
f000491,2341.020,2342.200,"No, did you — no, answer the question."
f000492,2342.200,2342.940,Why don’t you interrupt her?
f000493,2342.940,2344.000,You interrupt me all the time.
f000494,2344.000,2344.120,I do.
f000495,2344.120,2344.800,Why don’t you interrupt her?
f000496,2344.800,2349.260,Would you please explain whether or not the Muslim ban still stands?
f000497,2349.260,2351.960,It’s called extreme vetting.
f000498,2351.960,2360.160,We are going to areas like Syria where they’re coming in by the tens of thousands because of Barack Obama.
f000499,2360.160,2367.020,And Hillary Clinton wants to allow a 550 percent increase over Obama.
f000500,2367.020,2379.300,"People are coming into our country like we have no idea who they are, where they are from, what their feelings about our country is, and she wants 550 percent more."
f000501,2379.300,2381.680,This is going to be the great Trojan horse of all time.
f000502,2381.680,2384.500,We have enough problems in this country.
f000503,2384.500,2386.100,I believe in building safe zones.
f000504,2386.100,2394.320,"I believe in having other people pay for them, as an example, the Gulf states, who are not carrying their weight, but they have nothing but money, and take care of people."
n000156,2394.320,2394.760,(SILENCE)
f000505,2394.760,2405.320,"But I don’t want to have, with all the problems this country has and all of the problems that you see going on, hundreds of thousands of people coming in from Syria when we know nothing about them."
f000506,2405.320,2410.000,We know nothing about their values and we know nothing about their love for our country.
n000157,2410.000,2410.600,(SILENCE)
f000507,2410.600,2419.560,"And, Secretary Clinton, let me ask you about that, because you have asked for an increase from 10,000 to 65,000 Syrian refugees."
n000158,2419.560,2420.640,(SILENCE)
f000508,2420.640,2422.240,We know you want tougher vetting.
n000159,2422.240,2422.560,(SILENCE)
f000509,2422.560,2424.480,That’s not a perfect system.
n000160,2424.480,2424.880,(SILENCE)
f000510,2424.880,2429.280,So why take the risk of having those refugees come into the country?
f000511,2429.280,2434.320,"Well, first of all, I will not let anyone into our country that I think poses a risk to us."
n000161,2434.320,2435.320,(SILENCE)
f000512,2435.320,2448.200,"But there are a lot of refugees, women and children — think of that picture we all saw of that 4-year-old boy with the blood on his forehead because he’d been bombed by the Russian and Syrian air forces."
n000162,2448.200,2449.240,(SILENCE)
f000513,2449.240,2459.680,"There are children suffering in this catastrophic war, largely, I believe, because of Russian aggression."
f000514,2459.680,2461.900,And we need to do our part.
f000515,2461.900,2466.920,We by no means are carrying anywhere near the load that Europe and others are.
n000163,2466.920,2467.880,(SILENCE)
f000516,2467.880,2477.060,"But we will have vetting that is as tough as it needs to be from our professionals, our intelligence experts and others."
n000164,2477.060,2477.920,(SILENCE)
f000517,2477.920,2489.000,"But it is important for us as a policy, you know, not to say, as Donald has said, we’re going to ban people based on a religion."
n000165,2489.000,2489.320,(SILENCE)
f000518,2489.320,2490.180,How do you do that?
f000519,2490.180,2493.660,We are a country founded on religious freedom and liberty.
n000166,2493.660,2494.680,(SILENCE)
f000520,2494.680,2502.980,How do we do what he has advocated without causing great distress within our own county?
f000521,2502.980,2507.600,Are we going to have religious tests when people fly into our country?
n000167,2507.600,2508.480,(SILENCE)
f000522,2508.480,2512.860,And how do we expect to be able to implement those?
n000168,2512.860,2513.360,(SILENCE)
f000523,2513.360,2519.640,So I thought that what he said was extremely unwise and even dangerous.
n000169,2519.640,2520.320,(SILENCE)
f000524,2520.320,2538.240,"And indeed, you can look at the propaganda on a lot of the terrorists sites, and what Donald Trump says about Muslims is used to recruit fighters, because they want to create a war between us."
f000525,2538.240,2543.560,"And the final thing I would say, this is the 10th or 12th time that he’s denied being for the war in Iraq."
n000170,2543.560,2544.560,(SILENCE)
f000526,2544.560,2545.640,We have it on tape.
f000527,2545.640,2548.240,The entire press corps has looked at it.
f000528,2548.240,2552.280,"It’s been debunked, but it never stops him from saying whatever he wants to say."
f000529,2552.280,2552.680,That’s not been debunked.
n000171,2552.680,2553.160,(SILENCE)
f000530,2553.160,2554.040,"So, please..."
f000531,2554.040,2554.820,That has not been debunked.
f000532,2554.820,2556.640,... go to HillaryClinton.com and you can see it.
f000533,2556.640,2558.800,I was against — I was against the war in Iraq.
f000534,2558.800,2560.160,Has not been debunked.
n000172,2560.160,2560.560,(SILENCE)
f000535,2560.560,2561.620,And you voted for it.
f000536,2561.620,2562.600,And you shouldn’t have.
f000537,2562.600,2563.240,"Well, I just want to say..."
f000538,2563.240,2564.860,There’s been lots of fact-checking on that.
f000539,2564.860,2566.880,I’d like to move on to an online question...
f000540,2566.880,2567.120,Excuse me.
f000541,2567.120,2569.600,She just went about 25 seconds over her time.
f000542,2569.600,2569.720,She did not.
f000543,2569.720,2571.280,"Could I just respond to this, please?"
f000544,2571.280,2573.340,"Very quickly, please."
f000545,2573.340,2579.160,"Hillary Clinton, in terms of having people come into our country, we have many criminal illegal aliens."
f000546,2579.160,2583.560,"When we want to send them back to their country, their country says we don’t want them."
f000547,2583.560,2586.860,"In some cases, they’re murderers, drug lords, drug problems."
f000548,2586.860,2587.960,And they don’t want them.
f000549,2587.960,2593.280,"And Hillary Clinton, when she was secretary of state, said that’s OK, we can’t force it into their country."
f000550,2593.280,2596.300,"Let me tell you, I’m going to force them right back into their country."
f000551,2596.300,2599.060,They’re murderers and some very bad people.
f000552,2599.060,2610.240,"And I will tell you very strongly, when Bernie Sanders said she had bad judgment, she has really bad judgment, because we are letting people into this country that are going to cause problems and crime like you’ve never seen."
f000553,2610.240,2615.320,We’re also letting drugs pour through our southern border at a record clip.
f000554,2615.320,2616.720,At a record clip.
f000555,2616.720,2619.900,And it shouldn’t be allowed to happen.
f000556,2619.900,2621.380,ICE just endorsed me.
f000557,2621.380,2623.680,They’ve never endorsed a presidential candidate.
f000558,2623.680,2632.680,"The Border Patrol agents, 16,500, just recently endorsed me, and they endorsed me because I understand the border."
f000559,2632.680,2633.180,She doesn’t.
f000560,2633.180,2634.840,She wants amnesty for everybody.
f000561,2634.840,2635.640,Come right in.
n000173,2635.640,2636.080,(SILENCE)
f000562,2636.080,2636.960,Come right over.
f000563,2636.960,2639.240,It’s a horrible thing she’s doing.
f000564,2639.240,2645.900,"She’s got bad judgment, and honestly, so bad that she should never be president of the United States."
f000565,2645.900,2646.320,That I can tell you.
f000566,2646.320,2647.200,"Thank you, Mr. Trump."
f000567,2647.200,2648.220,I want to move on.
f000568,2648.220,2658.540,"This next question from the public through the Bipartisan Open Debate Coalition’s online forum, where Americans submitted questions that generated millions of votes."
f000569,2658.540,2677.260,"This question involves WikiLeaks release of purported excerpts of Secretary Clinton’s paid speeches, which she has refused to release, and one line in particular, in which you, Secretary Clinton, purportedly say you need both a public and private position on certain issues."
f000570,2677.260,2684.220,"So, Tu (ph), from Virginia asks, is it OK for politicians to be two-faced?"
f000571,2684.220,2689.040,Is it acceptable for a politician to have a private stance on issues?
f000572,2689.040,2691.300,"Secretary Clinton, your two minutes."
f000573,2691.300,2692.320,"Well, right."
f000574,2692.320,2705.800,"As I recall, that was something I said about Abraham Lincoln after having seen the wonderful Steven Spielberg movie called ""Lincoln."""
f000575,2705.800,2713.300,It was a master class watching President Lincoln get the Congress to approve the 13th Amendment.
n000174,2713.300,2714.240,(SILENCE)
f000576,2714.240,2717.520,"It was principled, and it was strategic."
f000577,2717.520,2727.420,And I was making the point that it is hard sometimes to get the Congress to do what you want to do and you have to keep working at it.
f000578,2727.420,2735.680,"And, yes, President Lincoln was trying to convince some people, he used some arguments, convincing other people, he used other arguments."
f000579,2735.680,2742.120,That was a great — I thought a great display of presidential leadership.
n000175,2742.120,2742.520,(SILENCE)
f000580,2742.520,2765.200,"But, you know, let’s talk about what’s really going on here, Martha, because our intelligence community just came out and said in the last few days that the Kremlin, meaning Putin and the Russian government, are directing the attacks, the hacking on American accounts to influence our election."
n000176,2765.200,2765.720,(SILENCE)
f000581,2765.720,2776.160,"And WikiLeaks is part of that, as are other sites where the Russians hack information, we don’t even know if it’s accurate information, and then they put it out."
n000177,2776.160,2776.840,(SILENCE)
f000582,2776.840,2788.760,"We have never in the history of our country been in a situation where an adversary, a foreign power, is working so hard to influence the outcome of the election."
n000178,2788.760,2789.240,(SILENCE)
f000583,2789.240,2793.000,"And believe me, they’re not doing it to get me elected."
f000584,2793.000,2796.280,They’re doing it to try to influence the election for Donald Trump.
f000585,2796.280,2806.520,"Now, maybe because he has praised Putin, maybe because he says he agrees with a lot of what Putin wants to do, maybe because he wants to do business in Moscow, I don’t know the reasons."
f000586,2806.520,2808.120,But we deserve answers.
n000179,2808.120,2808.680,(SILENCE)
f000587,2808.680,2817.520,And we should demand that Donald release all of his tax returns so that people can see what are the entanglements and the financial relationships that he has...
f000588,2817.520,2818.560,We’re going to get to that later.
f000589,2818.560,2820.300,"Secretary Clinton, you’re out of time."
f000590,2820.300,2821.840,... with the Russians and other foreign powers.
f000591,2821.840,2822.480,Mr. Trump?
f000592,2822.480,2825.400,"Well, I think I should respond, because — so ridiculous."
f000593,2825.400,2830.120,"Look, now she’s blaming — she got caught in a total lie."
n000180,2830.120,2830.520,(SILENCE)
f000594,2830.520,2838.500,"Her papers went out to all her friends at the banks, Goldman Sachs and everybody else, and she said things — WikiLeaks that just came out."
f000595,2838.500,2840.220,And she lied.
f000596,2840.220,2844.600,"Now she’s blaming the lie on the late, great Abraham Lincoln."
f000597,2844.600,2847.120,That’s one that I haven’t...
f000598,2847.120,2847.321,(LAUGHTER)
f000599,2847.321,2849.460,"OK, Honest Abe, Honest Abe never lied."
f000600,2849.460,2850.140,That’s the good thing.
f000601,2850.140,2853.480,That’s the big difference between Abraham Lincoln and you.
f000602,2853.480,2855.100,"That’s a big, big difference."
f000603,2855.100,2856.800,We’re talking about some difference.
f000604,2856.800,2863.820,"But as far as other elements of what she was saying, I don’t know Putin."
f000605,2863.820,2868.820,"I think it would be great if we got along with Russia because we could fight ISIS together, as an example."
f000606,2868.820,2870.360,But I don’t know Putin.
f000607,2870.360,2876.500,"But I notice, anytime anything wrong happens, they like to say the Russians are — she doesn’t know if it’s the Russians doing the hacking."
n000181,2876.500,2877.080,(SILENCE)
f000608,2877.080,2878.560,Maybe there is no hacking.
n000182,2878.560,2878.920,(SILENCE)
f000609,2878.920,2879.860,But they always blame Russia.
f000610,2879.860,2883.900,And the reason they blame Russia because they think they’re trying to tarnish me with Russia.
f000611,2883.900,2885.380,I know nothing about Russia.
f000612,2885.380,2889.520,"I know — I know about Russia, but I know nothing about the inner workings of Russia."
f000613,2889.520,2890.120,I don’t deal there.
f000614,2890.120,2891.240,I have no businesses there.
f000615,2891.240,2892.700,I have no loans from Russia.
f000616,2892.700,2911.240,"I have a very, very great balance sheet, so great that when I did the Old Post Office on Pennsylvania Avenue, the United States government, because of my balance sheet, which they actually know very well, chose me to do the Old Post Office, between the White House and Congress, chose me to do the Old Post Office."
f000617,2911.240,2915.280,"One of the primary area things, in fact, perhaps the primary thing was balance sheet."
n000183,2915.280,2915.840,(SILENCE)
f000618,2915.840,2918.160,But I have no loans with Russia.
f000619,2918.160,2926.840,"You could go to the United States government, and they would probably tell you that, because they know my sheet very well in order to get that development I had to have."
f000620,2926.840,2929.060,"Now, the taxes are a very simple thing."
f000621,2929.060,2933.080,"As soon as I have — first of all, I pay hundreds of millions of dollars in taxes."
n000184,2933.080,2933.520,(SILENCE)
f000622,2933.520,2936.320,Many of her friends took bigger deductions.
f000623,2936.320,2939.400,Warren Buffett took a massive deduction.
f000624,2939.400,2942.200,"Soros, who’s a friend of hers, took a massive deduction."
f000625,2942.200,2948.960,Many of the people that are giving her all this money that she can do many more commercials than me gave her — took massive deductions.
n000185,2948.960,2949.280,(SILENCE)
f000626,2949.280,2951.980,I pay hundreds of millions of dollars in taxes.
f000627,2951.980,2956.460,"But — but as soon as my routine audit is finished, I’ll release my returns."
f000628,2956.460,2956.820,I’ll be very proud to.
f000629,2956.820,2958.020,They’re actually quite great.
f000630,2958.020,2958.480,"Thank you, Mr. Trump."
n000186,2958.480,2958.880,(SILENCE)
f000631,2958.880,2961.280,"We want to turn, actually, to the topic of taxes."
f000632,2961.280,2962.920,We have a question from Spencer Maass.
n000187,2962.920,2963.360,(SILENCE)
f000633,2963.360,2963.680,Spencer?
n000188,2963.680,2968.400,(SILENCE)
f000634,2968.400,2969.060,Good evening.
n000189,2969.060,2969.680,(SILENCE)
f000635,2969.680,2976.400,"My question is, what specific tax provisions will you change to ensure the wealthiest Americans pay their fair share in taxes?"
n000190,2976.400,2976.840,(SILENCE)
f000636,2976.840,2977.920,"Mr. Trump, you have two minutes."
f000637,2977.920,2980.120,"Well, one thing I’d do is get rid of carried interest."
f000638,2980.120,2988.440,"One of the greatest provisions for people like me, to be honest with you, I give up a lot when I run, because I knock out the tax code."
n000191,2988.440,2989.200,(SILENCE)
f000639,2989.200,2990.760,"And she could have done this years ago, by the way."
f000640,2990.760,2992.980,She’s a United States — she was a United States senator.
n000192,2992.980,2993.680,(SILENCE)
f000641,2993.680,2997.000,She complains that Donald Trump took advantage of the tax code.
n000193,2997.000,2997.480,(SILENCE)
f000642,2997.480,2998.320,"Well, why didn’t she change it?"
f000643,2998.320,3000.640,Why didn’t you change it when you were a senator?
f000644,3000.640,3003.680,The reason you didn’t is that all your friends take the same advantage that I do.
f000645,3003.680,3004.160,And I do.
n000194,3004.160,3004.720,(SILENCE)
f000646,3004.720,3008.120,"You have provisions in the tax code that, frankly, we could change."
f000647,3008.120,3014.300,"But you wouldn’t change it, because all of these people gave you the money so you can take negative ads on Donald Trump."
n000195,3014.300,3015.120,(SILENCE)
f000648,3015.120,3017.360,But — and I say that about a lot of things.
f000649,3017.360,3021.000,"You know, I’ve heard Hillary complaining about so many different things over the years."
f000650,3021.000,3022.140,"""I wish you would have done this."""
f000651,3022.140,3024.360,But she’s been there for 30 years she’s been doing this stuff.
f000652,3024.360,3025.600,She never changed.
f000653,3025.600,3026.860,And she never will change.
f000654,3026.860,3028.760,She never will change.
f000655,3028.760,3031.020,We’re getting rid of carried interest provisions.
f000656,3031.020,3039.540,"I’m lowering taxes actually, because I think it’s so important for corporations, because we have corporations leaving — massive corporations and little ones, little ones can’t form."
f000657,3039.540,3044.000,We’re getting rid of regulations which goes hand in hand with the lowering of the taxes.
f000658,3044.000,3048.100,But we’re bringing the tax rate down from 35 percent to 15 percent.
f000659,3048.100,3050.220,We’re cutting taxes for the middle class.
f000660,3050.220,3054.140,"And I will tell you, we are cutting them big league for the middle class."
f000661,3054.140,3056.900,"And I will tell you, Hillary Clinton is raising your taxes, folks."
f000662,3056.900,3057.960,You can look at me.
f000663,3057.960,3061.440,She’s raising your taxes really high.
f000664,3061.440,3065.580,And what that’s going to do is a disaster for the country.
f000665,3065.580,3068.460,But she is raising your taxes and I’m lowering your taxes.
f000666,3068.460,3070.440,That in itself is a big difference.
f000667,3070.440,3072.080,We are going to be thriving again.
f000668,3072.080,3074.300,We have no growth in this country.
f000669,3074.300,3075.340,There’s no growth.
f000670,3075.340,3081.140,"If China has a GDP of 7 percent, it’s like a national catastrophe."
f000671,3081.140,3083.520,We’re down at 1 percent.
f000672,3083.520,3085.660,"And that’s, like, no growth."
f000673,3085.660,3087.960,"And we’re going lower, in my opinion."
f000674,3087.960,3092.520,"And a lot of it has to do with the fact that our taxes are so high, just about the highest in the world."
n000196,3092.520,3093.160,(SILENCE)
f000675,3093.160,3096.640,And I’m bringing them down to one of the lower in the world.
n000197,3096.640,3096.960,(SILENCE)
f000676,3096.960,3099.940,And I think it’s so important — one of the most important things we can do.
f000677,3099.940,3102.840,But she is raising everybody’s taxes massively.
n000198,3102.840,3103.280,(SILENCE)
f000678,3103.280,3104.580,"Secretary Clinton, you have two minutes."
f000679,3104.580,3109.580,"The question was, what specific tax provisions will you change to ensure the wealthiest Americans pay their fair share of taxes?"
n000199,3109.580,3111.080,(SILENCE)
f000680,3111.080,3114.380,"Well, everything you’ve heard just now from Donald is not true."
f000681,3114.380,3120.440,"I’m sorry I have to keep saying this, but he lives in an alternative reality."
f000682,3120.440,3127.180,And it is sort of amusing to hear somebody who hasn’t paid federal income taxes in maybe 20 years talking about what he’s going to do.
f000683,3127.180,3128.400,But I’ll tell you what he’s going to do.
n000200,3128.400,3129.160,(SILENCE)
f000684,3129.160,3139.960,"His plan will give the wealthy and corporations the biggest tax cuts they’ve ever had, more than the Bush tax cuts by at least a factor of two."
f000685,3139.960,3146.320,"Donald always takes care of Donald and people like Donald, and this would be a massive gift."
n000201,3146.320,3146.760,(SILENCE)
f000686,3146.760,3156.200,"And, indeed, the way that he talks about his tax cuts would end up raising taxes on middle-class families, millions of middle-class families."
f000687,3156.200,3157.140,"Now, here’s what I want to do."
n000202,3157.140,3157.840,(SILENCE)
f000688,3157.840,3169.120,"I have said nobody who makes less than $250,000 a year — and that’s the vast majority of Americans as you know — will have their taxes raised, because I think we’ve got to go where the money is."
f000689,3169.120,3174.240,And the money is with people who have taken advantage of every single break in the tax code.
f000690,3174.240,3178.520,"And, yes, when I was a senator, I did vote to close corporate loopholes."
f000691,3178.520,3187.240,"I voted to close, I think, one of the loopholes he took advantage of when he claimed a billion-dollar loss that enabled him to avoid paying taxes."
n000203,3187.240,3187.800,(SILENCE)
f000692,3187.800,3193.760,I want to have a tax on people who are making a million dollars.
f000693,3193.760,3195.100,It’s called the Buffett rule.
f000694,3195.100,3201.640,"Yes, Warren Buffett is the one who’s gone out and said somebody like him should not be paying a lower tax rate than his secretary."
f000695,3201.640,3205.380,I want to have a surcharge on incomes above $5 million.
f000696,3205.380,3208.780,"We have to make up for lost times, because I want to invest in you."
f000697,3208.780,3211.240,I want to invest in hard-working families.
f000698,3211.240,3220.680,"And I think it’s been unfortunate, but it’s happened, that since the Great Recession, the gains have all gone to the top."
f000699,3220.680,3221.800,And we need to reverse that.
n000204,3221.800,3222.440,(SILENCE)
f000700,3222.440,3231.240,"People like Donald, who paid zero in taxes, zero for our vets, zero for our military, zero for health and education, that is wrong."
f000701,3231.240,3232.240,"Thank you, Secretary."
f000702,3232.240,3240.520,"And we’re going to make sure that nobody, no corporation, and no individual can get away without paying his fair share to support our country."
f000703,3240.520,3240.680,Thank you.
f000704,3240.680,3243.040,"I want to give you — Mr. Trump, I want to give you the chance to respond."
f000705,3243.040,3244.960,I just wanted to tell our viewers what she’s referring to.
f000706,3244.960,3248.920,"In the last month, taxes were the number-one issue on Facebook for the first time in the campaign."
n000205,3248.920,3249.440,(SILENCE)
f000707,3249.440,3252.920,The New York Times published three pages of your 1995 tax returns.
f000708,3252.920,3259.400,"They show you claimed a $916 million loss, which means you could have avoided paying personal federal income taxes for years."
n000206,3259.400,3259.760,(SILENCE)
f000709,3259.760,3263.520,"You’ve said you pay state taxes, employee taxes, real estate taxes, property taxes."
n000207,3263.520,3263.920,(SILENCE)
f000710,3263.920,3266.520,"You have not answered, though, a simple question."
f000711,3266.520,3270.900,Did you use that $916 million loss to avoid paying personal federal income taxes for years?
f000712,3270.900,3271.600,Of course I do.
n000208,3271.600,3272.040,(SILENCE)
f000713,3272.040,3272.760,Of course I do.
n000209,3272.760,3273.200,(SILENCE)
f000714,3273.200,3275.780,"And so do all of her donors, or most of her donors."
f000715,3275.780,3277.080,I know many of her donors.
n000210,3277.080,3277.720,(SILENCE)
f000716,3277.720,3279.560,Her donors took massive tax write-offs.
