f000215,1147.520,1151.820,"And once the border is secured, at a later date, we’ll make a determination as to the rest."
n000075,1151.820,1152.360,(SILENCE)
f000216,1152.360,1155.440,"But we have some bad hombres here, and we’re going to get them out."
n000076,1155.440,1156.480,(SILENCE)
f000217,1156.480,1157.220,"Mr. Trump, thank you."
f000218,1157.220,1159.880,"Same question to you, Secretary Clinton."
n000077,1159.880,1160.200,(SILENCE)
f000219,1160.200,1162.680,"Basically, why are you right and Mr. Trump is wrong?"
n000078,1162.680,1163.200,(SILENCE)
f000220,1163.200,1177.000,"Well, as he was talking, I was thinking about a young girl I met here in Las Vegas, Carla, who is very worried that her parents might be deported, because she was born in this country but they were not."
n000079,1177.000,1177.480,(SILENCE)
f000221,1177.480,1181.380,"They work hard, they do everything they can to give her a good life."
f000222,1181.380,1182.080,And you’re right.
f000223,1182.080,1183.760,I don’t want to rip families apart.
n000080,1183.760,1184.160,(SILENCE)
f000224,1184.160,1187.080,I don’t want to be sending parents away from children.
n000081,1187.080,1187.560,(SILENCE)
f000225,1187.560,1195.400,I don’t want to see the deportation force that Donald has talked about in action in our country.
f000226,1195.400,1197.500,We have 11 million undocumented people.
f000227,1197.500,1201.860,"They have 4 million American citizen children, 15 million people."
n000082,1201.860,1202.400,(SILENCE)
f000228,1202.400,1209.080,He said as recently as a few weeks ago in Phoenix that every undocumented person would be subject to deportation.
f000229,1209.080,1210.000,"Now, here’s what that means."
n000083,1210.000,1210.480,(SILENCE)
f000230,1210.480,1224.880,"It means you would have to have a massive law enforcement presence, where law enforcement officers would be going school to school, home to home, business to business, rounding up people who are undocumented."
f000231,1224.880,1231.460,"And we would then have to put them on trains, on buses to get them out of our country."
f000232,1231.460,1236.480,I think that is an idea that is not in keeping with who we are as a nation.
n000084,1236.480,1236.960,(SILENCE)
f000233,1236.960,1240.880,I think it’s an idea that would rip our country apart.
f000234,1240.880,1243.500,I have been for border security for years.
f000235,1243.500,1246.620,I voted for border security in the United States Senate.
f000236,1246.620,1251.320,And my comprehensive immigration reform plan of course includes border security.
f000237,1251.320,1258.840,But I want to put our resources where I think they’re most needed: Getting rid of any violent person.
n000085,1258.840,1259.200,(SILENCE)
f000238,1259.200,1262.400,"Anybody who should be deported, we should deport them."
n000086,1262.400,1263.000,(SILENCE)
f000239,1263.000,1268.760,"When it comes to the wall that Donald talks about building, he went to Mexico, he had a meeting with the Mexican president."
n000087,1268.760,1269.080,(SILENCE)
f000240,1269.080,1269.980,Didn’t even raise it.
f000241,1269.980,1275.560,He choked and then got into a Twitter war because the Mexican president said we’re not paying for that wall.
f000242,1275.560,1283.320,So I think we are both a nation of immigrants and we are a nation of laws and that we can act accordingly.
f000243,1283.320,1289.020,And that’s why I’m introducing comprehensive immigration reform within the first 100 days with the path to citizenship.
f000244,1289.020,1290.540,"Thank you, Secretary Clinton."
f000245,1290.540,1291.520,I want to follow up...
f000246,1291.520,1292.720,"Chris, I think it’s..."
f000247,1292.720,1292.940,OK.
f000248,1292.940,1294.560,I think I should respond to that.
n000088,1294.560,1294.880,(SILENCE)
f000249,1294.880,1298.000,"First of all, I had a very good meeting with the president of Mexico."
f000250,1298.000,1299.540,Very nice man.
f000251,1299.540,1302.920,We will be doing very much better with Mexico on trade deals.
f000252,1302.920,1303.400,Believe me.
n000089,1303.400,1303.840,(SILENCE)
f000253,1303.840,1308.860,"The NAFTA deal signed by her husband is one of the worst deals ever made of any kind, signed by anybody."
f000254,1308.860,1310.260,It’s a disaster.
f000255,1310.260,1312.000,Hillary Clinton wanted the wall.
n000090,1312.000,1312.520,(SILENCE)
f000256,1312.520,1317.280,Hillary Clinton fought for the wall in 2006 or thereabouts.
n000091,1317.280,1318.080,(SILENCE)
f000257,1318.080,1322.160,"Now, she never gets anything done, so naturally the wall wasn’t built."
n000092,1322.160,1322.960,(SILENCE)
f000258,1322.960,1325.340,But Hillary Clinton wanted the wall.
f000259,1325.340,1327.080,"Well, let me — wait, wait, sir, let me..."
f000260,1327.080,1327.780,We are a country of laws.
f000261,1327.780,1329.580,We either have — and by the way...
f000262,1329.580,1329.880,"Now, wait."
f000263,1329.880,1330.640,I’d like to hear from...
f000264,1330.640,1331.600,"Well — well, but she said one thing."
f000265,1331.600,1333.520,I’d like to hear — I’d like to hear from Secretary Clinton.
n000093,1333.520,1334.000,(SILENCE)
f000266,1334.000,1337.280,"I voted for border security, and there are..."
f000267,1337.280,1337.980,And the wall.
f000268,1337.980,1341.240,There are some limited places where that was appropriate.
f000269,1341.240,1345.980,There also is necessarily going to be new technology and how best to deploy that.
n000094,1345.980,1346.440,(SILENCE)
f000270,1346.440,1363.200,"But it is clear, when you look at what Donald has been proposing, he started his campaign bashing immigrants, calling Mexican immigrants rapists and criminals and drug dealers, that he has a very different view about what we should do to deal with immigrants."
f000271,1363.200,1377.820,"Now, what I am also arguing is that bringing undocumented immigrants out from the shadows, putting them into the formal economy will be good, because then employers can’t exploit them and undercut Americans’ wages."
f000272,1377.820,1379.360,And Donald knows a lot about this.
f000273,1379.360,1382.880,He used undocumented labor to build the Trump Tower.
f000274,1382.880,1390.580,"He underpaid undocumented workers, and when they complained, he basically said what a lot of employers do: ""You complain, I’ll get you deported."""
f000275,1390.580,1401.300,"I want to get everybody out of the shadows, get the economy working, and not let employers like Donald exploit undocumented workers, which hurts them, but also hurts American workers."
f000276,1401.300,1401.940,Mr. Trump?
f000277,1401.940,1404.780,President Obama has moved millions of people out.
f000278,1404.780,1406.860,"Nobody knows about it, nobody talks about it."
f000279,1406.860,1409.920,"But under Obama, millions of people have been moved out of this country."
f000280,1409.920,1411.140,They’ve been deported.
f000281,1411.140,1415.520,"She doesn’t want to say that, but that’s what’s happened, and that’s what happened big league."
f000282,1415.520,1421.500,As far as moving these people out and moving — we either have a country or we don’t.
f000283,1421.500,1422.160,We’re a country of laws.
f000284,1422.160,1423.940,We either have a border or we don’t.
f000285,1423.940,1427.320,"Now, you can come back in and you can become a citizen."
n000095,1427.320,1427.760,(SILENCE)
f000286,1427.760,1428.560,But it’s very unfair.
f000287,1428.560,1431.200,We have millions of people that did it the right way.
f000288,1431.200,1432.100,They’re on line.
f000289,1432.100,1432.520,They’re waiting.
f000290,1432.520,1435.960,"We’re going to speed up the process, big league, because it’s very inefficient."
n000096,1435.960,1436.560,(SILENCE)
f000291,1436.560,1438.980,But they’re on line and they’re waiting to become citizens.
f000292,1438.980,1444.700,"Very unfair that somebody runs across the border, becomes a citizen, under her plan, you have open borders."
f000293,1444.700,1448.820,"You would have a disaster on trade, and you will have a disaster with your open borders."
f000294,1448.820,1449.120,I want to...
f000295,1449.120,1456.120,But what she doesn’t say is that President Obama has deported millions and millions of people just the way it is.
f000296,1456.120,1457.600,"Secretary Clinton, I want to..."
f000297,1457.600,1458.120,We will not have open borders.
f000298,1458.120,1458.840,That is...
f000299,1458.840,1460.720,"Well, let me — Secretary..."
f000300,1460.720,1462.520,That is a rank mischaracterization.
f000301,1462.520,1463.280,Secretary Clinton...
f000302,1463.280,1467.380,"We will have secure borders, but we’ll also have reform."
f000303,1467.380,1469.120,And this used to be a bipartisan issue.
n000097,1469.120,1469.440,(SILENCE)
f000304,1469.440,1470.720,Ronald Reagan was the last president...
f000305,1470.720,1471.720,"Secretary Clinton, excuse me."
f000306,1471.720,1472.160,Secretary Clinton.
f000307,1472.160,1475.720,"... to sign immigration reform, and George W. Bush supported it, as well."
f000308,1475.720,1488.680,"Secretary Clinton, I want to clear up your position on this issue, because in a speech you gave to a Brazilian bank, for which you were paid $225,000, we’ve learned from the WikiLeaks, that you said this, and I want to quote."
n000098,1488.680,1489.080,(SILENCE)
f000309,1489.080,1494.260,"""My dream is a hemispheric common market with open trade and open borders."""
f000310,1494.260,1495.500,So that’s the question...
f000311,1495.500,1497.060,Thank you.
n000099,1497.060,1498.000,(SILENCE)
f000312,1498.000,1498.660,That’s the question.
f000313,1498.660,1500.280,"Please quiet, everybody."
f000314,1500.280,1501.980,"Is that your dream, open borders?"
f000315,1501.980,1506.920,"Well, if you went on to read the rest of the sentence, I was talking about energy."
n000100,1506.920,1507.240,(SILENCE)
f000316,1507.240,1512.980,"You know, we trade more energy with our neighbors than we trade with the rest of the world combined."
f000317,1512.980,1519.660,"And I do want us to have an electric grid, an energy system that crosses borders."
f000318,1519.660,1521.860,I think that would be a great benefit to us.
f000319,1521.860,1526.020,But you are very clearly quoting from WikiLeaks.
f000320,1526.020,1535.320,And what’s really important about WikiLeaks is that the Russian government has engaged in espionage against Americans.
n000101,1535.320,1535.920,(SILENCE)
f000321,1535.920,1543.320,"They have hacked American websites, American accounts of private people, of institutions."
n000102,1543.320,1543.680,(SILENCE)
f000322,1543.680,1550.080,Then they have given that information to WikiLeaks for the purpose of putting it on the Internet.
n000103,1550.080,1550.520,(SILENCE)
f000323,1550.520,1562.500,"This has come from the highest levels of the Russian government, clearly, from Putin himself, in an effort, as 17 of our intelligence agencies have confirmed, to influence our election."
f000324,1562.500,1587.400,"So I actually think the most important question of this evening, Chris, is, finally, will Donald Trump admit and condemn that the Russians are doing this and make it clear that he will not have the help of Putin in in this election, that he rejects Russian espionage against Americans, which he actually encouraged in the past?"
n000104,1587.400,1587.800,(SILENCE)
f000325,1587.800,1589.380,Those are the questions we need answered.
f000326,1589.380,1592.400,We’ve never had anything like this happen in any of our elections before.
f000327,1592.400,1592.600,Well?
n000105,1592.600,1593.000,(SILENCE)
f000328,1593.000,1597.080,"That was a great pivot off the fact that she wants open borders, OK?"
f000329,1597.080,1599.280,How did we get on to Putin?
f000330,1599.280,1601.220,"Hold on — hold on, wait."
f000331,1601.220,1602.080,"Hold on, folks."
n000106,1602.080,1602.480,(SILENCE)
f000332,1602.480,1604.700,Because we — this is going to end up getting out of control.
f000333,1604.700,1608.480,Let’s try to keep it quiet so — for the candidates and for the American people.
f000334,1608.480,1610.060,So just to finish on the borders...
f000335,1610.060,1610.200,Yes?
n000107,1610.200,1610.560,(SILENCE)
f000336,1610.560,1612.220,She wants open borders.
f000337,1612.220,1614.280,People are going to pour into our country.
f000338,1614.280,1616.360,People are going to come in from Syria.
n000108,1616.360,1616.680,(SILENCE)
f000339,1616.680,1623.120,"She wants 550 percent more people than Barack Obama, and he has thousands and thousands of people."
f000340,1623.120,1624.880,They have no idea where they come from.
f000341,1624.880,1630.380,"And you see, we are going to stop radical Islamic terrorism in this country."
f000342,1630.380,1633.500,"She won’t even mention the words, and neither will President Obama."
f000343,1633.500,1636.680,"So I just want to tell you, she wants open borders."
f000344,1636.680,1638.040,Now we can talk about Putin.
f000345,1638.040,1638.540,I don’t know Putin.
n000109,1638.540,1639.200,(SILENCE)
f000346,1639.200,1640.360,He said nice things about me.
f000347,1640.360,1642.840,"If we got along well, that would be good."
n000110,1642.840,1643.360,(SILENCE)
f000348,1643.360,1648.320,"If Russia and the United States got along well and went after ISIS, that would be good."
n000111,1648.320,1648.760,(SILENCE)
f000349,1648.760,1650.520,He has no respect for her.
n000112,1650.520,1651.000,(SILENCE)
f000350,1651.000,1652.720,He has no respect for our president.
n000113,1652.720,1653.320,(SILENCE)
f000351,1653.320,1667.400,"And I’ll tell you what: We’re in very serious trouble, because we have a country with tremendous numbers of nuclear warheads — 1,800, by the way — where they expanded and we didn’t, 1,800 nuclear warheads."
n000114,1667.400,1667.800,(SILENCE)
f000352,1667.800,1668.520,And she’s playing chicken.
f000353,1668.520,1668.740,"Look, Putin..."
f000354,1668.740,1669.720,"Wait, but..."
n000115,1669.720,1670.400,(SILENCE)
f000355,1670.400,1676.000,"... from everything I see, has no respect for this person."
n000116,1676.000,1676.360,(SILENCE)
f000356,1676.360,1680.040,"Well, that’s because he’d rather have a puppet as president of the United States."
f000357,1680.040,1681.260,No puppet.
f000358,1681.260,1681.520,No puppet.
f000359,1681.520,1681.960,And it’s pretty clear...
f000360,1681.960,1682.320,You’re the puppet!
f000361,1682.320,1683.760,It’s pretty clear you won’t admit...
f000362,1683.760,1684.440,"No, you’re the puppet."
f000363,1684.440,1711.460,"... that the Russians have engaged in cyberattacks against the United States of America, that you encouraged espionage against our people, that you are willing to spout the Putin line, sign up for his wish list, break up NATO, do whatever he wants to do, and that you continue to get help from him, because he has a very clear favorite in this race."
f000364,1711.460,1716.160,So I think that this is such an unprecedented situation.
f000365,1716.160,1720.680,We’ve never had a foreign government trying to interfere in our election.
f000366,1720.680,1738.060,"We have 17 — 17 intelligence agencies, civilian and military, who have all concluded that these espionage attacks, these cyberattacks, come from the highest levels of the Kremlin and they are designed to influence our election."
f000367,1738.060,1739.580,I find that deeply disturbing.
f000368,1739.580,1740.520,Secretary Clinton...
f000369,1740.520,1742.360,And I think it’s time you take a stand...
f000370,1742.360,1745.200,"She has no idea whether it’s Russia, China, or anybody else."
f000371,1745.200,1746.000,I am not quoting myself.
f000372,1746.000,1746.720,She has no idea.
f000373,1746.720,1748.000,I am quoting 17...
f000374,1748.000,1749.040,"Hillary, you have no idea."
f000375,1749.040,1751.360,... 17 intelligence — do you doubt 17 military and civilian...
f000376,1751.360,1753.800,And our country has no idea.
f000377,1753.800,1754.560,... agencies.
f000378,1754.560,1755.360,"Yeah, I doubt it."
f000379,1755.360,1755.640,I doubt it.
f000380,1755.640,1763.840,"Well, he’d rather believe Vladimir Putin than the military and civilian intelligence professionals who are sworn to protect us."
f000381,1763.840,1765.480,I find that just absolutely...
f000382,1765.480,1765.481,(CROSSTALK)
f000383,1765.481,1770.860,She doesn’t like Putin because Putin has outsmarted her at every step of the way.
f000384,1770.860,1771.520,Mr. Trump...
n000117,1771.520,1772.160,(SILENCE)
f000385,1772.160,1772.520,Excuse me.
f000386,1772.520,1774.040,Putin has outsmarted her in Syria.
n000118,1774.040,1774.440,(SILENCE)
f000387,1774.440,1775.480,Mr. Trump...
f000388,1775.480,1775.481,(CROSSTALK)
f000389,1775.481,1777.800,He’s outsmarted her every step of the way.
f000390,1777.800,1779.180,I do get to ask some questions.
f000391,1779.180,1779.720,"Yes, that’s fine."
f000392,1779.720,1782.000,And I would like to ask you this direct question.
n000119,1782.000,1782.440,(SILENCE)
f000393,1782.440,1787.880,The top national security officials of this country do believe that Russia has been behind these hacks.
n000120,1787.880,1788.840,(SILENCE)
f000394,1788.840,1796.320,"Even if you don’t know for sure whether they are, do you condemn any interference by Russia in the American election?"
f000395,1796.320,1798.120,By Russia or anybody else.
f000396,1798.120,1799.360,You condemn their interference?
f000397,1799.360,1800.420,Of course I condemn.
f000398,1800.420,1801.840,Of course I — I don’t know Putin.
n000121,1801.840,1802.520,(SILENCE)
f000399,1802.520,1803.160,I have no idea.
f000400,1803.160,1803.960,I’m not asking — I’m asking do you condemn?
f000401,1803.960,1804.880,I never met Putin.
f000402,1804.880,1806.540,This is not my best friend.
f000403,1806.540,1810.240,"But if the United States got along with Russia, wouldn’t be so bad."
f000404,1810.240,1815.600,"Let me tell you, Putin has outsmarted her and Obama at every single step of the way."
f000405,1815.600,1817.960,"Whether it’s Syria, you name it."
f000406,1817.960,1819.100,Missiles.
f000407,1819.100,1821.840,"Take a look at the ""start up"" that they signed."
n000122,1821.840,1822.600,(SILENCE)
f000408,1822.600,1828.620,"The Russians have said, according to many, many reports, I can’t believe they allowed us to do this."
f000409,1828.620,1830.900,"They create warheads, and we can’t."
n000123,1830.900,1831.320,(SILENCE)
f000410,1831.320,1832.880,The Russians can’t believe it.
f000411,1832.880,1834.800,She has been outsmarted by Putin.
f000412,1834.800,1836.480,And all you have to do is look at the Middle East.
f000413,1836.480,1837.260,They’ve taken over.
f000414,1837.260,1839.120,We’ve spent $6 trillion.
f000415,1839.120,1841.200,They’ve taken over the Middle East.
f000416,1841.200,1847.720,She has been outsmarted and outplayed worse than anybody I’ve ever seen in any government whatsoever.
f000417,1847.720,1852.580,"We’re a long way away from immigration, but I’m going to let you finish this topic."
f000418,1852.580,1854.720,You got about 45 seconds.
f000419,1854.720,1856.200,And she always will be.
f000420,1856.200,1860.640,I — I find it ironic that he’s raising nuclear weapons.
f000421,1860.640,1866.340,"This is a person who has been very cavalier, even casual about the use of nuclear weapons."
f000422,1866.340,1866.640,He’s...
n000124,1866.640,1866.960,(SILENCE)
f000423,1866.960,1867.260,Wrong.
f000424,1867.260,1871.280,"... advocated more countries getting them, Japan, Korea, even Saudi Arabia."
n000125,1871.280,1871.800,(SILENCE)
f000425,1871.800,1876.040,"He said, well, if we have them, why don’t we use them, which I think is terrifying."
n000126,1876.040,1876.400,(SILENCE)
f000426,1876.400,1877.280,But here’s the deal.
f000427,1877.280,1884.480,"The bottom line on nuclear weapons is that when the president gives the order, it must be followed."
n000127,1884.480,1885.040,(SILENCE)
f000428,1885.040,1892.720,There’s about four minutes between the order being given and the people responsible for launching nuclear weapons to do so.
n000128,1892.720,1893.560,(SILENCE)
f000429,1893.560,1907.320,"And that’s why 10 people who have had that awesome responsibility have come out and, in an unprecedented way, said they would not trust Donald Trump with the nuclear codes or to have his finger on the nuclear button."
f000430,1907.320,1909.040,I have 200 generals...
f000431,1909.040,1909.260,Very quickly.
f000432,1909.260,1915.240,"... and admirals, 21 endorsing me, 21 congressional Medal of Honor recipients."
n000129,1915.240,1915.720,(SILENCE)
f000433,1915.720,1923.620,"As far as Japan and other countries, we are being ripped off by everybody in the — we’re defending other countries."
f000434,1923.620,1925.380,We are spending a fortune doing it.
n000130,1925.380,1925.840,(SILENCE)
f000435,1925.840,1927.780,They have the bargain of the century.
f000436,1927.780,1937.780,"All I said is, we have to renegotiate these agreements, because our country cannot afford to defend Saudi Arabia, Japan, Germany, South Korea, and many other places."
f000437,1937.780,1941.800,We cannot continue to afford — she took that as saying nuclear weapons.
n000131,1941.800,1942.880,(SILENCE)
f000438,1942.880,1943.920,OK.
f000439,1943.920,1946.760,"Look, she’s been proven to be a liar on so many different ways."
n000132,1946.760,1947.080,(SILENCE)
f000440,1947.080,1948.720,This is just another lie.
n000133,1948.720,1949.520,(SILENCE)
f000441,1949.520,1951.420,"Well, I’m just quoting you when you were asked..."
f000442,1951.420,1952.560,There’s no quote.
f000443,1952.560,1954.360,You’re not going to find a quote from me.
f000444,1954.360,1962.240,"... about a potential nuclear — nuclear competition in Asia, you said, you know, go ahead, enjoy yourselves, folks."
n000134,1962.240,1963.080,(SILENCE)
f000445,1963.080,1963.800,That kind...
f000446,1963.800,1964.720,And defend yourselves.
f000447,1964.720,1966.040,... of language — well...
f000448,1966.040,1967.200,And defend yourselves.
f000449,1967.200,1967.760,I didn’t say nuclear.
f000450,1967.760,1968.620,And defend yourself.
f000451,1968.620,1973.440,The United States has kept the peace — the United States has kept the peace through our alliances.
n000135,1973.440,1974.280,(SILENCE)
f000452,1974.280,1976.260,Donald wants to tear up our alliances.
f000453,1976.260,1980.280,"I think it makes the world safer and, frankly, it makes the United States safer."
f000454,1980.280,1985.200,"I would work with our allies in Asia, in Europe, in the Middle East, and elsewhere."
n000136,1985.200,1985.640,(SILENCE)
f000455,1985.640,1987.760,That’s the only way we’re going to be able to keep the peace.
f000456,1987.760,1991.800,"We’re going to — no, we are going to move on to the next topic, which is the economy."
f000457,1991.800,1995.260,And I hope we handle that as well as we did immigration.
f000458,1995.260,2000.920,You also have very different ideas about how to get the economy growing faster.
f000459,2000.920,2005.820,"Secretary Clinton, in your plan, government plays a big role."
f000460,2005.820,2012.600,"You see more government spending, more entitlements, more tax credits, more tax penalties."
n000137,2012.600,2013.200,(SILENCE)
f000461,2013.200,2017.600,"Mr. Trump, you want to get government out with lower taxes and less regulation."
f000462,2017.600,2017.900,Yes.
f000463,2017.900,2019.780,We’re going to drill down into this a little bit more.
f000464,2019.780,2029.320,"But in this overview, please explain to me why you believe that your plan will create more jobs and growth for this country and your opponent’s plan will not."
n000138,2029.320,2029.720,(SILENCE)
f000465,2029.720,2031.240,"In this round, you go first, Secretary Clinton."
f000466,2031.240,2034.720,"Well, I think when the middle class thrives, America thrives."
f000467,2034.720,2041.920,"And so my plan is based on growing the economy, giving middle-class families many more opportunities."
n000139,2041.920,2042.360,(SILENCE)
f000468,2042.360,2049.400,"I want us to have the biggest jobs program since World War II, jobs in infrastructure and advanced manufacturing."
f000469,2049.400,2052.920,"I think we can compete with high-wage countries, and I believe we should."
n000140,2052.920,2053.480,(SILENCE)
f000470,2053.480,2060.860,"New jobs and clean energy, not only to fight climate change, which is a serious problem, but to create new opportunities and new businesses."
n000141,2060.860,2061.320,(SILENCE)
f000471,2061.320,2063.300,I want us to do more to help small business.
f000472,2063.300,2065.840,That’s where two- thirds of the new jobs are going to come from.
n000142,2065.840,2066.360,(SILENCE)
f000473,2066.360,2074.600,"I want us to raise the national minimum wage, because people who live in poverty should not — who work full-time should not still be in poverty."
f000474,2074.600,2078.740,And I sure do want to make sure women get equal pay for the work we do.
f000475,2078.740,2084.200,I feel strongly that we have to have an education system that starts with preschool and goes through college.
f000476,2084.200,2092.440,"That’s why I want more technical education in high schools and in community colleges, real apprenticeships to prepare young people for the jobs of the future."
n000143,2092.440,2092.920,(SILENCE)
f000477,2092.920,2105.920,"I want to make college debt-free and for families making less than $125,000, you will not get a tuition bill from a public college or university if the plan that I worked on with Bernie Sanders is enacted."
n000144,2105.920,2106.280,(SILENCE)
f000478,2106.280,2111.960,"And we’re going to work hard to make sure that it is, because we are going to go where the money is."
