f000479,2111.960,2116.920,Most of the gains in the last years since the Great Recession have gone to the very top.
n000145,2116.920,2117.360,(SILENCE)
f000480,2117.360,2120.760,So we are going to have the wealthy pay their fair share.
f000481,2120.760,2126.040,We’re going to have corporations make a contribution greater than they are now to our country.
n000146,2126.040,2126.760,(SILENCE)
f000482,2126.760,2133.440,That is a plan that has been analyzed by independent experts which said that it could produce 10 million new jobs.
f000483,2133.440,2140.500,"By contrast, Donald’s plan has been analyzed to conclude it might lose 3.5 million jobs."
f000484,2140.500,2140.860,Why?
f000485,2140.860,2159.260,"Because his whole plan is to cut taxes, to give the biggest tax breaks ever to the wealthy and to corporations, adding $20 trillion to our debt, and causing the kind of dislocation that we have seen before, because it truly will be trickle-down economics on steroids."
n000147,2159.260,2159.640,(SILENCE)
f000486,2159.640,2163.360,So the plan I have I think will actually produce greater opportunities.
n000148,2163.360,2163.680,(SILENCE)
f000487,2163.680,2168.260,The plan he has will cost us jobs and possibly lead to another Great Recession.
f000488,2168.260,2169.440,"Secretary, thank you."
f000489,2169.440,2173.700,"Mr. Trump, why will your plan create more jobs and growth than Secretary Clinton’s?"
f000490,2173.700,2179.760,"Well, first of all, before I start on my plan, her plan is going to raise taxes and even double your taxes."
f000491,2179.760,2181.960,Her tax plan is a disaster.
n000149,2181.960,2182.360,(SILENCE)
f000492,2182.360,2185.440,And she can say all she wants about college tuition.
f000493,2185.440,2186.520,And I’m a big proponent.
f000494,2186.520,2188.680,We’re going to do a lot of things for college tuition.
f000495,2188.680,2191.140,But the rest of the public’s going to be paying for it.
f000496,2191.140,2195.200,"We will have a massive, massive tax increase under Hillary Clinton’s plan."
f000497,2195.200,2207.540,"But I’d like to start off where we left, because when I said Japan and Germany, and I’m — not to single them out, but South Korea, these are very rich, powerful countries."
f000498,2207.540,2210.360,"Saudi Arabia, nothing but money."
f000499,2210.360,2211.280,We protect Saudi Arabia.
n000150,2211.280,2212.240,(SILENCE)
f000500,2212.240,2213.180,Why aren’t they paying?
f000501,2213.180,2216.660,"She immediately — when she heard this, I questioned it, and I questioned NATO."
f000502,2216.660,2218.740,Why aren’t the NATO questioned — why aren’t they paying?
f000503,2218.740,2219.700,Because they weren’t paying.
f000504,2219.700,2223.600,"Since I did this — this was a year ago — all of a sudden, they’re paying."
f000505,2223.600,2225.400,And I’ve been given a lot — a lot of credit for it.
f000506,2225.400,2227.060,"All of a sudden, they’re starting to pay up."
f000507,2227.060,2228.100,They have to pay up.
f000508,2228.100,2230.400,"We’re protecting people, they have to pay up."
f000509,2230.400,2231.480,And I’m a big fan of NATO.
n000151,2231.480,2232.120,(SILENCE)
f000510,2232.120,2232.920,But they have to pay up.
f000511,2232.920,2236.960,"She comes out and said, we love our allies, we think our allies are great."
f000512,2236.960,2241.880,"Well, it’s awfully hard to get them to pay up when you have somebody saying we think how great they are."
n000152,2241.880,2242.560,(SILENCE)
f000513,2242.560,2250.280,"We have to tell Japan in a very nice way, we have to tell Germany, all of these countries, South Korea, we have to say, you have to help us out."
n000153,2250.280,2250.840,(SILENCE)
f000514,2250.840,2257.340,"We have, during his regime, during President Obama’s regime, we’ve doubled our national debt."
f000515,2257.340,2259.820,We’re up to $20 trillion.
f000516,2259.820,2262.600,So my plan — we’re going to renegotiate trade deals.
f000517,2262.600,2263.260,We’re going to have a lot of free trade.
f000518,2263.260,2265.320,"We’re going to have free trade, more free trade than we have right now."
f000519,2265.320,2267.340,But we have horrible deals.
f000520,2267.340,2271.860,"Our jobs are being taken out by the deal that her husband signed, NAFTA, one of the worst deals ever."
f000521,2271.860,2274.980,Our jobs are being sucked out of our economy.
f000522,2274.980,2281.200,"You look at all of the places that I just left, you go to Pennsylvania, you go to Ohio, you go to Florida, you go to any of them."
f000523,2281.200,2282.500,You go upstate New York.
f000524,2282.500,2285.500,Our jobs have fled to Mexico and other places.
f000525,2285.500,2287.340,We’re bringing our jobs back.
f000526,2287.340,2289.380,I am going to renegotiate NAFTA.
f000527,2289.380,2293.500,And if I can’t make a great deal — then we’re going to terminate NAFTA and we’re going to create new deals.
f000528,2293.500,2298.740,"We’re going to have trade, but we’re going — we’re going to terminate it, we’re going to make a great trade deal."
f000529,2298.740,2303.500,"And if we can’t, we’re going to do it — we’re going to go a separate way, because it has been a disaster."
f000530,2303.500,2305.980,We are going to cut taxes massively.
f000531,2305.980,2308.000,We’re going to cut business taxes massively.
f000532,2308.000,2309.720,They’re going to start hiring people.
n000154,2309.720,2310.040,(SILENCE)
f000533,2310.040,2311.600,We’re going to bring the $2.5 trillion...
f000534,2311.600,2312.200,"Time, Mr. Trump."
f000535,2312.200,2313.800,... that’s offshore back into the country.
n000155,2313.800,2314.120,(SILENCE)
f000536,2314.120,2316.720,"We are going to start the engine rolling again, because..."
f000537,2316.720,2317.040,Mr. Trump?
f000538,2317.040,2320.760,"... right now, our country is dying at 1 percent GDP."
n000156,2320.760,2321.440,(SILENCE)
f000539,2321.440,2325.660,"Well, let me translate that, if I can, Chris, because..."
f000540,2325.660,2326.540,You can’t.
f000541,2326.540,2335.680,"... the fact is, he’s going to advocate for the largest tax cuts we’ve ever seen, three times more than the tax cuts under the Bush administration."
n000157,2335.680,2336.160,(SILENCE)
f000542,2336.160,2343.920,"I have said repeatedly throughout this campaign: I will not raise taxes on anyone making $250,000 or less."
n000158,2343.920,2344.600,(SILENCE)
f000543,2344.600,2347.200,I also will not add a penny to the debt.
n000159,2347.200,2347.800,(SILENCE)
f000544,2347.800,2350.140,I have costed out what I’m going to do.
f000545,2350.140,2354.140,"He will, through his massive tax cuts, add $20 trillion to the debt."
f000546,2354.140,2355.960,"Well, he mentioned the debt."
n000160,2355.960,2356.360,(SILENCE)
f000547,2356.360,2358.160,We know how to get control of the debt.
f000548,2358.160,2367.440,"When my husband was president, we went from a $300 billion deficit to a $200 billion surplus and we were actually on the path to eliminating the national debt."
n000161,2367.440,2367.960,(SILENCE)
f000549,2367.960,2373.080,"When President Obama came into office, he inherited the worst economic disaster since the Great Depression."
n000162,2373.080,2373.480,(SILENCE)
f000550,2373.480,2375.820,He has cut the deficit by two-thirds.
n000163,2375.820,2376.200,(SILENCE)
f000551,2376.200,2382.500,"So, yes, one of the ways you go after the debt, one of the ways you create jobs is by investing in people."
n000164,2382.500,2383.040,(SILENCE)
f000552,2383.040,2393.400,"So I do have investments, investments in new jobs, investments in education, skill training, and the opportunities for people to get ahead and stay ahead."
n000165,2393.400,2393.760,(SILENCE)
f000553,2393.760,2396.400,That’s the kind of approach that will work.
n000166,2396.400,2396.920,(SILENCE)
f000554,2396.920,2397.080,Secretary...
f000555,2397.080,2399.580,"Cutting taxes on the wealthy, we’ve tried that."
f000556,2399.580,2402.680,It has not worked the way that it has been promised.
f000557,2402.680,2417.200,"Secretary Clinton, I want to pursue your plan, because in many ways it is similar to the Obama stimulus plan in 2009, which has led to the slowest GDP growth since 1949."
n000167,2417.200,2417.520,(SILENCE)
f000558,2417.520,2418.160,Correct.
n000168,2418.160,2419.040,(SILENCE)
f000559,2419.040,2421.060,"Thank you, sir."
f000560,2421.060,2429.080,You told me in July when we spoke that the problem is that President Obama didn’t get to do enough in what he was trying to do with his stimulus.
f000561,2429.080,2433.560,So is your plan basically more — even more of the Obama stimulus?
n000169,2433.560,2434.200,(SILENCE)
f000562,2434.200,2435.760,"Well, it’s a combination, Chris."
f000563,2435.760,2447.980,"And let me say that when you inherit the level of economic catastrophe that President Obama inherited, it was a real touch-and-go situation."
f000564,2447.980,2450.860,I was in the Senate before I became secretary of state.
f000565,2450.860,2460.880,I’ve never seen people as physically distraught as the Bush administration team was because of what was happening to the economy.
n000170,2460.880,2461.560,(SILENCE)
f000566,2461.560,2467.720,I personally believe that the steps that President Obama took saved the economy.
f000567,2467.720,2472.240,He doesn’t get the credit he deserves for taking some very hard positions.
n000171,2472.240,2472.760,(SILENCE)
f000568,2472.760,2475.120,But it was a terrible recession.
f000569,2475.120,2479.160,"So now we’ve dug ourselves out of it, we’re standing, but we’re not yet running."
n000172,2479.160,2479.640,(SILENCE)
f000570,2479.640,2486.720,"So what I am proposing is that we invest from the middle out and the ground up, not the top down."
f000571,2486.720,2488.200,That is not going to work.
n000173,2488.200,2488.680,(SILENCE)
f000572,2488.680,2499.400,"That’s why what I have put forward doesn’t add a penny to the debt, but it is the kind of approach that will enable more people to take those new jobs, higher-paying jobs."
f000573,2499.400,2507.120,"We’re beginning to see some increase in incomes, and we certainly have had a long string of increasing jobs."
f000574,2507.120,2513.160,"We’ve got to do more to get the whole economy moving, and that’s what I believe I will be able to do."
f000575,2513.160,2524.620,"Mr. Trump, even conservative economists who have looked at your plan say that the numbers don’t add up, that your idea, and you’ve talked about 25 million jobs created, 4 percent..."
f000576,2524.620,2525.280,Over a 10-year period.
n000174,2525.280,2525.640,(SILENCE)
f000577,2525.640,2527.860,... growth is unrealistic.
n000175,2527.860,2528.360,(SILENCE)
f000578,2528.360,2532.120,And they say — you talk a lot about growing the energy industry.
f000579,2532.120,2535.960,"They say with oil prices as low as they are right now, that’s unrealistic, as well."
f000580,2535.960,2537.240,"Your response, sir?"
f000581,2537.240,2540.880,So I just left some high representatives of India.
n000176,2540.880,2541.480,(SILENCE)
f000582,2541.480,2542.860,They’re growing at 8 percent.
n000177,2542.860,2543.760,(SILENCE)
f000583,2543.760,2545.840,China is growing at 7 percent.
f000584,2545.840,2548.480,And that for them is a catastrophically low number.
n000178,2548.480,2549.480,(SILENCE)
f000585,2549.480,2553.940,We are growing — our last report came out — and it’s right around the 1 percent level.
f000586,2553.940,2555.840,And I think it’s going down.
f000587,2555.840,2560.720,"Last week, as you know, the end of last week, they came out with an anemic jobs report."
f000588,2560.720,2562.220,A terrible jobs report.
f000589,2562.220,2566.440,"In fact I said, is that the last jobs report before the election?"
f000590,2566.440,2569.200,"Because if it is, I should win easily, it was so bad."
n000179,2569.200,2569.880,(SILENCE)
f000591,2569.880,2570.880,The report was so bad.
n000180,2570.880,2571.800,(SILENCE)
f000592,2571.800,2575.340,"Look, our country is stagnant."
f000593,2575.340,2576.440,We’ve lost our jobs.
f000594,2576.440,2577.880,We’ve lost our businesses.
n000181,2577.880,2578.320,(SILENCE)
f000595,2578.320,2581.060,"We’re not making things anymore, relatively speaking."
n000182,2581.060,2581.840,(SILENCE)
f000596,2581.840,2586.400,"Our product is pouring in from China, pouring in from Vietnam, pouring in from all over the world."
n000183,2586.400,2587.000,(SILENCE)
f000597,2587.000,2588.840,I’ve visited so many communities.
f000598,2588.840,2591.320,"This has been such an incredible education for me, Chris."
n000184,2591.320,2591.840,(SILENCE)
f000599,2591.840,2595.400,I’ve gotten to know so many — I’ve developed so many friends over the last year.
n000185,2595.400,2596.520,(SILENCE)
f000600,2596.520,2598.860,And they cry when they see what’s happened.
f000601,2598.860,2610.460,"I pass factories that were thriving 20, 25 years ago, and because of the bill that her husband signed and she blessed 100 percent, it is just horrible what’s happened to these people in these communities."
f000602,2610.460,2619.160,"Now, she can say that her husband did well, but, boy, did they suffer as NAFTA kicked in, because it didn’t really kick in very much, but it kicked in after they left."
f000603,2619.160,2620.120,"Boy, did they suffer."
n000186,2620.120,2620.640,(SILENCE)
f000604,2620.640,2624.200,That was one of the worst things that’s ever been signed by our country.
f000605,2624.200,2626.880,Now she wants to sign Trans-Pacific Partnership.
f000606,2626.880,2627.780,And she wants it.
f000607,2627.780,2631.400,She lied when she said she didn’t call it the gold standard in one of the debates.
f000608,2631.400,2632.200,She totally lied.
n000187,2632.200,2632.520,(SILENCE)
f000609,2632.520,2633.840,She did call it the gold standard.
f000610,2633.840,2636.580,"And they actually fact checked, and they said I was right."
f000611,2636.580,2637.700,I was so honored.
f000612,2637.700,2642.160,"I want you to give you a chance to briefly speak to that, and then I want to pivot to one-sixth of the economy..."
f000613,2642.160,2643.080,And that will be as bad as NAFTA.
f000614,2643.080,2643.940,... which is Obamacare.
f000615,2643.940,2645.020,"But go ahead, briefly."
f000616,2645.020,2652.300,"Well, first, let me say, number one, when I saw the final agreement for TPP, I said I was against it."
f000617,2652.300,2653.100,It didn’t meet my test.
f000618,2653.100,2654.400,I’ve had the same test.
n000188,2654.400,2654.840,(SILENCE)
f000619,2654.840,2658.840,"Does it create jobs, raise incomes, and further our national security?"
f000620,2658.840,2659.740,I’m against it now.
f000621,2659.740,2661.060,I’ll be against it after the election.
f000622,2661.060,2662.740,I’ll be against it when I’m president.
f000623,2662.740,2667.640,"There’s only one of us on this stage who’s actually shipped jobs to Mexico, because that’s Donald."
f000624,2667.640,2670.700,"He’s shipped jobs to 12 countries, including Mexico."
f000625,2670.700,2671.640,But he mentioned China.
n000189,2671.640,2672.120,(SILENCE)
f000626,2672.120,2678.800,"And, you know, one of the biggest problems we have with China is the illegal dumping of steel and aluminum into our markets."
f000627,2678.800,2681.280,I have fought against that as a senator.
f000628,2681.280,2683.440,I’ve stood up against it as secretary of state.
n000190,2683.440,2683.840,(SILENCE)
f000629,2683.840,2686.520,Donald has bought Chinese steel and aluminum.
n000191,2686.520,2686.840,(SILENCE)
f000630,2686.840,2691.020,"In fact, the Trump Hotel right here in Las Vegas was made with Chinese steel."
f000631,2691.020,2698.440,"So he goes around with crocodile tears about how terrible it is, but he has given jobs to Chinese steelworkers, not American steelworkers."
f000632,2698.440,2698.920,Mr. Trump?
f000633,2698.920,2702.760,That’s the kind of approach that is just not going to work.
f000634,2702.760,2704.160,"Well, let me just say — let me just say."
f000635,2704.160,2704.540,We’re going to pull the country together.
f000636,2704.540,2706.560,We’re going to have trade agreements that we enforce.
f000637,2706.560,2710.220,That’s why I’m going to have a trade prosecutor for the first time in history.
f000638,2710.220,2717.520,"And we’re going to enforce those agreements, and we’re going to look for businesses to help us by buying American products."
f000639,2717.520,2717.840,Secretary Clinton?
f000640,2717.840,2718.400,"Go ahead, Mr. Trump."
f000641,2718.400,2719.320,Let me ask a simple question.
n000192,2719.320,2719.720,(SILENCE)
f000642,2719.720,2721.400,She’s been doing this for 30 years.
n000193,2721.400,2721.880,(SILENCE)
f000643,2721.880,2725.140,"Why the hell didn’t you do it over the last 15, 20 years?"
f000644,2725.140,2725.720,"No, I voted."
n000194,2725.720,2726.080,(SILENCE)
f000645,2726.080,2727.820,You were very much involved — excuse me.
n000195,2727.820,2728.560,(SILENCE)
f000646,2728.560,2728.840,My turn.
n000196,2728.840,2729.280,(SILENCE)
f000647,2729.280,2732.960,You were very much involved in every aspect of this country.
n000197,2732.960,2733.440,(SILENCE)
f000648,2733.440,2733.840,Very much.
n000198,2733.840,2734.280,(SILENCE)
f000649,2734.280,2735.260,And you do have experience.
f000650,2735.260,2740.480,"I say the one thing you have over me is experience, but it’s bad experience, because what you’ve done has turned out badly."
f000651,2740.480,2749.860,"For 30 years, you’ve been in a position to help, and if you say that I use steel or I use something else, I — make it impossible for me to do that."
f000652,2749.860,2750.680,I wouldn’t mind.
n000199,2750.680,2751.240,(SILENCE)
f000653,2751.240,2754.480,"The problem is, you talk, but you don’t get anything done, Hillary."
n000200,2754.480,2754.800,(SILENCE)
f000654,2754.800,2755.180,You don’t.
n000201,2755.180,2755.600,(SILENCE)
f000655,2755.600,2761.660,"Just like when you ran the State Department, $6 billion was missing."
f000656,2761.660,2762.960,How do you miss $6 billion?
f000657,2762.960,2766.860,"You ran the State Department, $6 billion was either stolen."
f000658,2766.860,2768.540,They don’t know.
f000659,2768.540,2769.620,"It’s gone, $6 billion."
n000202,2769.620,2770.720,(SILENCE)
f000660,2770.720,2776.280,"If you become president, this country is going to be in some mess."
f000661,2776.280,2776.840,Believe me.
n000203,2776.840,2777.240,(SILENCE)
f000662,2777.240,2783.480,"Well, first of all, what he just said about the State Department is not only untrue, it’s been debunked numerous times."
n000204,2783.480,2783.880,(SILENCE)
f000663,2783.880,2787.240,But I think it’s really an important issue.
f000664,2787.240,2791.040,"He raised the 30 years of experience, so let me just talk briefly about that."
n000205,2791.040,2791.680,(SILENCE)
f000665,2791.680,2795.500,"You know, back in the 1970s, I worked for the Children’s Defense Fund."
f000666,2795.500,2800.520,And I was taking on discrimination against African-American kids in schools.
n000206,2800.520,2801.040,(SILENCE)
f000667,2801.040,2805.740,He was getting sued by the Justice Department for racial discrimination in his apartment buildings.
n000207,2805.740,2806.160,(SILENCE)
f000668,2806.160,2810.440,"In the 1980s, I was working to reform the schools in Arkansas."
n000208,2810.440,2811.040,(SILENCE)
f000669,2811.040,2814.820,He was borrowing $14 million from his father to start his businesses.
n000209,2814.820,2815.440,(SILENCE)
f000670,2815.440,2819.380,"In the 1990s, I went to Beijing and I said women’s rights are human rights."
n000210,2819.380,2819.920,(SILENCE)
f000671,2819.920,2824.380,"He insulted a former Miss Universe, Alicia Machado, called her an eating machine."
f000672,2824.380,2824.880,Give me a break.
f000673,2824.880,2834.620,"And on the day when I was in the Situation Room, monitoring the raid that brought Osama bin Laden to justice, he was hosting the ""Celebrity Apprentice."""
f000674,2834.620,2849.280,"So I’m happy to compare my 30 years of experience, what I’ve done for this country, trying to help in every way I could, especially kids and families get ahead and stay ahead, with your 30 years, and I’ll let the American people make that decision."
f000675,2849.280,2851.260,"Well, I think I did a much better job."
f000676,2851.260,2858.320,"I built a massive company, a great company, some of the greatest assets anywhere in the world, worth many, many billions of dollars."
n000211,2858.320,2858.880,(SILENCE)
f000677,2858.880,2861.260,I started with a $1 million loan.
f000678,2861.260,2862.080,I agree with that.
f000679,2862.080,2863.360,It’s a $1 million loan.
f000680,2863.360,2866.740,But I built a phenomenal company.
f000681,2866.740,2873.040,"And if we could run our country the way I’ve run my company, we would have a country that you would be so proud of."
n000212,2873.040,2873.560,(SILENCE)
f000682,2873.560,2875.260,You would even be proud of it.
f000683,2875.260,2880.300,"And frankly, when you look at her real record, take a look at Syria."
f000684,2880.300,2881.700,Take a look at the migration.
f000685,2881.700,2882.800,Take a look at Libya.
n000213,2882.800,2883.200,(SILENCE)
f000686,2883.200,2884.280,Take a look at Iraq.
n000214,2884.280,2884.920,(SILENCE)
f000687,2884.920,2897.720,"She gave us ISIS, because her and Obama created this huge vacuum, and a small group came out of that huge vacuum because when — we should never have been in Iraq, but once we were there, we should have never got out the way they wanted to get out."
n000215,2897.720,2898.200,(SILENCE)
f000688,2898.200,2900.960,She gave us ISIS as sure as you are sitting there.
n000216,2900.960,2901.480,(SILENCE)
f000689,2901.480,2905.060,And what happened is now ISIS is in 32 countries.
f000690,2905.060,2907.360,And now I listen how she’s going to get rid of ISIS.
n000217,2907.360,2907.880,(SILENCE)
f000691,2907.880,2910.620,She’s going to get rid of nobody.
f000692,2910.620,2910.820,All right.
f000693,2910.820,2918.580,"We are going to get to foreign hot spots in a few moments, but the next segment is fitness to be president of the United States."
f000694,2918.580,2927.940,"Mr. Trump, at the last debate, you said your talk about grabbing women was just that, talk, and that you’d never actually done it."
f000695,2927.940,2939.720,"And since then, as we all know, nine women have come forward and have said that you either groped them or kissed them without their consent."
f000696,2939.720,2950.580,"Why would so many different women from so many different circumstances over so many different years, why would they all in this last couple of weeks make up — you deny this — why would they all make up these stories?"
f000697,2950.580,2960.520,"Since this is a question for both of you, Secretary Clinton, Mr. Trump says what your husband did and that you defended was even worse."
n000218,2960.520,2960.960,(SILENCE)
f000698,2960.960,2962.120,"Mr. Trump, you go first."
f000699,2962.120,2965.060,"Well, first of all, those stories have been largely debunked."
n000219,2965.060,2965.800,(SILENCE)
f000700,2965.800,2967.340,Those people — I don’t know those people.
n000220,2967.340,2967.840,(SILENCE)
f000701,2967.840,2969.380,I have a feeling how they came.
f000702,2969.380,2971.000,I believe it was her campaign that did it.
f000703,2971.000,2981.180,Just like if you look at what came out today on the clips where I was wondering what happened with my rally in Chicago and other rallies where we had such violence?
n000221,2981.180,2982.160,(SILENCE)
f000704,2982.160,2984.800,She’s the one and Obama that caused the violence.
n000222,2984.800,2985.160,(SILENCE)
f000705,2985.160,2993.000,"They hired people — they paid them $1,500, and they’re on tape saying be violent, cause fights, do bad things."
n000223,2993.000,2993.320,(SILENCE)
f000706,2993.320,2996.900,"I would say the only way — because those stories are all totally false, I have to say that."
n000224,2996.900,2997.880,(SILENCE)
f000707,2997.880,3004.160,"And I didn’t even apologize to my wife, who’s sitting right here, because I didn’t do anything."
f000708,3004.160,3006.240,I didn’t know any of these — I didn’t see these women.
n000225,3006.240,3006.640,(SILENCE)
f000709,3006.640,3012.680,"These women — the woman on the plane, the — I think they want either fame or her campaign did it."
f000710,3012.680,3013.920,And I think it’s her campaign.
n000226,3013.920,3014.400,(SILENCE)
f000711,3014.400,3023.360,"Because what I saw what they did, which is a criminal act, by the way, where they’re telling people to go out and start fist-fights and start violence."
f000712,3023.360,3029.400,"And I’ll tell you what, in particular in Chicago, people were hurt and people could have been killed in that riot."
n000227,3029.400,3029.800,(SILENCE)
f000713,3029.800,3032.760,"And that was now all on tape, started by her."
n000228,3032.760,3033.280,(SILENCE)
f000714,3033.280,3037.820,"I believe, Chris, that she got these people to step forward."
f000715,3037.820,3040.520,"If it wasn’t, they get their 10 minutes of fame."
n000229,3040.520,3041.280,(SILENCE)
f000716,3041.280,3043.920,But they were all totally — it was all fiction.
f000717,3043.920,3045.560,"It was lies, and it was fiction."
n000230,3045.560,3047.160,(SILENCE)
f000718,3047.160,3047.540,Well...
f000719,3047.540,3048.880,Secretary Clinton?
f000720,3048.880,3055.400,"At the last debate, we heard Donald talking about what he did to women."
f000721,3055.400,3062.200,"And after that, a number of women have come forward saying that’s exactly what he did to them."
n000231,3062.200,3062.520,(SILENCE)
f000722,3062.520,3064.000,"Now, what was his response?"
