f000792,4109.880,4114.620,"But it no longer is Obamacare, because without the individual mandate, it’s much different."
f000793,4114.620,4117.260,Pre-existing conditions will always stay.
f000794,4117.260,4120.880,"What I would like to do is a much better healthcare, much better."
n000244,4120.880,4122.000,(SILENCE)
f000795,4122.000,4124.300,We’ll always protect people with pre-existing.
f000796,4124.300,4128.800,"So I’d like to terminate Obamacare, come up with a brand new, beautiful healthcare."
f000797,4128.800,4131.880,"The Democrats will do it, because there’ll be tremendous pressure on them."
f000798,4131.880,4134.080,And we might even have the House by that time.
f000799,4134.080,4135.760,And I think we’re going to win the House.
f000800,4135.760,4137.980,"You’ll see, but I think we’re going to win the House."
f000801,4137.980,4143.520,"But come up with a better healthcare, always protecting people with pre-existing conditions."
f000802,4143.520,4149.240,"And one thing very important, we have 180 million people out there that have great private healthcare."
n000245,4149.240,4149.600,(SILENCE)
f000803,4149.600,4151.920,Far more than we’re talking about with Obamacare.
n000246,4151.920,4152.320,(SILENCE)
f000804,4152.320,4155.160,Joe Biden is going to terminate all of those policies.
f000805,4155.160,4157.240,These are people that love their healthcare.
n000247,4157.240,4157.680,(SILENCE)
f000806,4157.680,4161.880,"People that have been successful, middle-income people, been successful."
f000807,4161.880,4167.560,"They have 180 million plans, 180 million people, families."
n000248,4167.560,4168.040,(SILENCE)
f000808,4168.040,4176.240,"Under what he wants to do, which will basically be socialized medicine, he won’t even have a choice, they want to terminate 180 million plans."
f000809,4176.240,4181.080,"We have done an incredible job at healthcare, and we’re going to do even better."
f000810,4181.080,4181.800,Just you watch.
f000811,4181.800,4182.360,Okay.
f000812,4182.360,4184.400,"Vice President Biden, yes, this is for you."
f000813,4184.400,4187.040,Your healthcare plan calls for building on Obamacare.
f000814,4187.040,4191.980,"So my question is, what is your plan if the law is ruled unconstitutional by the Supreme Court?"
f000815,4191.980,4193.880,You have two minutes uninterrupted.
n000249,4193.880,4194.480,(SILENCE)
f000816,4194.480,4199.480,"What I’m going to do is pass Obamacare with a public option, and become Bidencare."
n000250,4199.480,4199.800,(SILENCE)
f000817,4199.800,4215.280,"The public option is an option that says that if you in fact do not have the wherewithal, if you qualify for Medicaid and you do not have the wherewithal in your state to get Medicaid, you automatically are enrolled, providing competition for insurance companies."
n000251,4215.280,4215.640,(SILENCE)
f000818,4215.640,4216.480,That’s what’s going to happen.
f000819,4216.480,4231.600,"Secondly, we’re going to make sure we reduce the premiums and reduce drug prices by making sure that there’s competition, that doesn’t exist now, by allowing Medicare to negotiate drug prices with the insurance companies."
f000820,4231.600,4243.560,"Thirdly, the idea that I want to eliminate private insurance, the reason why I had such a fight with 20 candidates for the nomination was I support private insurance."
n000252,4243.560,4243.880,(SILENCE)
f000821,4243.880,4244.920,That’s why.
n000253,4244.920,4245.320,(SILENCE)
f000822,4245.320,4252.840,"Not one single person with private insurance would lose their insurance under my plan, nor did they under Obamacare."
n000254,4252.840,4253.200,(SILENCE)
f000823,4253.200,4257.880,They did not lose their insurance unless they chose they wanted to go to something else.
f000824,4257.880,4263.120,"Lastly, we’re going to make sure we’re in a situation that we actually protect pre-existing."
f000825,4263.120,4265.360,There’s no way he can protect pre-existing conditions.
n000255,4265.360,4265.880,(SILENCE)
f000826,4265.880,4267.040,"None, zero."
f000827,4267.040,4268.360,You can’t do it in the ether.
n000256,4268.360,4269.040,(SILENCE)
f000828,4269.040,4271.340,He’s been talking about this for a long time.
f000829,4271.340,4273.440,He’s never come up with a plan.
f000830,4273.440,4282.360,"I guess we’re going to get the pre-existing condition plan the same time we got the infrastructure plan that we waited for since ’17, ’18, ’19, and 20."
f000831,4282.360,4284.960,I still have a few more minutes.
f000832,4284.960,4286.160,I know you’re getting anxious.
f000833,4286.160,4293.720,"The fact is that he’s already cost the American people, because of his terrible handling of the COVID virus and economic spillover."
f000834,4293.720,4305.680,"10 million people have lost their private insurance, and he wants to take away 22 million more people who have it under Obamacare and over 110 million people with pre-existing conditions."
f000835,4305.680,4309.760,"And all the people from COVID are going to have pre-existing conditions, what are they going to do?"
n000257,4309.760,4310.120,(SILENCE)
f000836,4310.120,4311.880,I have a follow-up for you Vice President Biden.
f000837,4311.880,4314.360,It relates to something that President Trump said.
f000838,4314.360,4316.720,He’s accusing you of wanting socialized medicine.
f000839,4316.720,4322.560,"What do you say to people who have concerns that your healthcare plan, which includes a government insurance option, takes-"
f000840,4322.560,4329.480,"Concerns that your healthcare plan, which includes a government insurance option, takes the country one step closer to a healthcare system run entirely by the government."
f000841,4329.480,4331.400,What’s your response to that?
f000842,4331.400,4332.140,I say it’s ridiculous.
f000843,4332.140,4337.120,"It’s like saying that the fact that there’s a public option that people can choose, that makes it a socialist plan."
f000844,4337.120,4341.600,"Look, the difference between the president and I… I think healthcare is not a privilege, it’s a right."
n000258,4341.600,4342.400,(SILENCE)
f000845,4342.400,4347.160,"Everyone should have the right to have affordable healthcare, and I am very proud of my plan."
f000846,4347.160,4355.960,"It’s gotten endorsed by all the major labor unions, as well as a whole range of other people who, in fact, are concerned in the medical field."
f000847,4355.960,4358.360,This is something that’s going to save people’s lives.
f000848,4358.360,4363.360,And this is going to give some people an opportunity to have healthcare for their children.
f000849,4363.360,4373.120,"How many of you at home are worried and rolling around in bed tonight, wondering what in God’s name you’re going to do if you get sick, because you’ve lost your health insurance and your company’s gone under?"
n000259,4373.120,4373.680,(SILENCE)
f000850,4373.680,4377.840,"We have to provide health insurance for people at an affordable rate, and that’s what I do."
f000851,4377.840,4377.960,President Trump-
n000260,4377.960,4378.600,(SILENCE)
f000852,4378.600,4379.400,Excuse me.
f000853,4379.400,4380.320,He was there-
f000854,4380.320,4380.660,… your response.
f000855,4380.660,4381.800,… for 47 years.
f000856,4381.800,4383.200,He didn’t do it.
f000857,4383.200,4385.880,He was now there as vice president for eight years.
f000858,4385.880,4387.920,And it’s not like it was 25 years ago.
f000859,4387.920,4392.720,"It was three and three quarters… It was just a little while ago, right?"
f000860,4392.720,4394.260,Less than four years ago.
f000861,4394.260,4395.340,He didn’t do anything.
f000862,4395.340,4396.440,He didn’t do it.
f000863,4396.440,4397.960,He wants socialized medicine.
f000864,4397.960,4399.180,And it’s not that he wants it.
f000865,4399.180,4405.960,"His vice president, she is more liberal than Bernie Sanders and wants it even more."
f000866,4405.960,4407.280,Bernie Sanders wants it.
f000867,4407.280,4408.280,The Democrats want it.
f000868,4408.280,4411.880,"You’re going to have socialized medicine, just like you want it with fracking."
n000261,4411.880,4412.240,(SILENCE)
f000869,4412.240,4413.560,“We’re not going to have fracking.
f000870,4413.560,4414.520,We’re going to stop fracking.
f000871,4414.520,4419.120,"We’re going to stop fracking.” Then he goes to Pennsylvania after he gets a nomination, where he got very lucky to get it."
f000872,4419.120,4424.960,"And he goes to Pennsylvania, and he says, “Oh, we’re going to have fracking.” And you never ask that question."
f000873,4424.960,4429.080,"And by the way, so far, I respect very much the way you’re handling this, I have to say."
f000874,4429.080,4429.240,By the way-
f000875,4429.240,4430.800,But somebody should ask the question.
f000876,4430.800,4431.400,You can ask it.
f000877,4431.400,4433.120,"He goes for a year, there will be no fracking."
f000878,4433.120,4434.000,We do have a number-
f000879,4434.000,4435.240,There will be no petroleum-
f000880,4435.240,4437.200,We have a number of topics we’re going to get to.
f000881,4437.200,4437.640,"No, no."
f000882,4437.640,4439.080,But that’s a big question.
f000883,4439.080,4440.120,We’re going to get to a number of topics-
f000884,4440.120,4441.560,It’s the same thing with socialized medicine.
f000885,4441.560,4442.720,I have to respond to healthcare.
f000886,4442.720,4443.600,"Vice President, your response please."
f000887,4443.600,4446.840,"My response is, people deserve to have affordable healthcare, period."
n000262,4446.840,4447.400,(SILENCE)
f000888,4447.400,4449.000,"Period, period, period."
f000889,4449.000,4454.000,"And the Biden care proposal will in fact provide for that affordable healthcare, lower premiums."
f000890,4454.000,4455.480,What we’re going to do is going to cost some money.
n000263,4455.480,4455.960,(SILENCE)
f000891,4455.960,4459.840,It’s going to cost over $750 billion over 10 years to do it.
f000892,4459.840,4461.320,And they’re going to have lower premiums.
f000893,4461.320,4470.960,"You can buy into the better plans, the cheaper plans, lower your premiums, deal with unexpected billing, and have your drug prices drop significantly."
f000894,4470.960,4472.080,He keeps talking about it.
f000895,4472.080,4473.280,He hasn’t done a thing for anybody on healthcare.
f000896,4473.280,4473.920,Not a thing.
f000897,4473.920,4475.280,"Kristen, when he says-"
f000898,4475.280,4479.520,"Very quickly, then I want to talk about what’s happening on Capitol Hill."
f000899,4479.520,4483.440,"When he says public option, he’s talking about socialized medicine and healthcare."
f000900,4483.440,4488.280,"When he talks about a public option, he’s talking about destroying your Medicare, totally destroying-"
f000901,4488.280,4488.480,Wrong.
f000902,4488.480,4490.400,… and destroying your Social Security.
f000903,4490.400,4492.560,And this whole country will come down.
f000904,4492.560,4494.800,Bernie Sanders tried it in his state.
f000905,4494.800,4495.040,Bernie.
f000906,4495.040,4496.320,He tried it in his state.
f000907,4496.320,4498.360,His governor was a very liberal governor.
f000908,4498.360,4499.360,They wanted to make it work.
f000909,4499.360,4499.720,Okay.
f000910,4499.720,4499.880,Let’s hear-
f000911,4499.880,4500.480,It was impossible to work.
f000912,4500.480,4502.440,Let’s let Vice President Biden respond-
f000913,4502.440,4503.160,It doesn’t work.
f000914,4503.160,4504.600,He’s a very confused guy.
f000915,4504.600,4506.160,He thinks he’s running against somebody else.
f000916,4506.160,4507.920,He’s running against Joe Biden.
n000264,4507.920,4508.600,(SILENCE)
f000917,4508.600,4512.080,I beat all those other people because I disagreed with them.
f000918,4512.080,4513.520,"Joe Biden, he’s running against."
f000919,4513.520,4523.320,"And the idea that we’re in a situation that is going to destroy Medicare… This is the guy that the actuary of Medicare said, “If in fact…” That’s Social Security."
f000920,4523.320,4537.760,"“If in fact he continues his plan to withhold the tax on Social Security, Social Security will be bankrupt by 2023 with no way to make up for it.” This is the guy who’s tried to cut Medicare."
n000265,4537.760,4538.120,(SILENCE)
f000921,4538.120,4541.040,The idea that Donald Trump is lecturing me on Social Security and Medicare?
f000922,4541.040,4541.400,Come on.
f000923,4541.400,4543.000,He tried to get rid of-
f000924,4543.000,4547.920,"10 seconds, Mr. President, and then I have to go to another question."
f000925,4547.920,4550.760,He tried to hurt Social Security years ago.
f000926,4550.760,4551.720,Years ago.
n000266,4551.720,4552.080,(SILENCE)
f000927,4552.080,4553.760,Go back and look at the records.
f000928,4553.760,4555.440,He tried to hurt Social Security years ago.
f000929,4555.440,4555.520,One thing.
f000930,4555.520,4556.040,But this is the guy-
f000931,4556.040,4556.320,All right.
f000932,4556.320,4556.600,Let’s move on.
f000933,4556.600,4556.601,I’m going to move on.
f000934,4556.601,4557.400,… that when they announced last week-
f000935,4557.400,4563.200,"Mr. President, I have to move on to the next question or else we’re not going to have time to talk about it."
f000936,4563.200,4564.640,They say the stock market will boom if I’m elected.
f000937,4564.640,4565.520,"If he’s elected, the stock market will crash."
f000938,4565.520,4565.640,Okay.
f000939,4565.640,4566.720,Let’s move on to the next question.
f000940,4566.720,4568.520,The biggest analysts are saying that.
f000941,4568.520,4569.320,May I respond?
f000942,4569.320,4569.560,Very quickly.
f000943,4569.560,4575.200,"Look, the idea that the stock market is booming is his only measure of what’s happening."
f000944,4575.200,4580.180,"Where I come from in Scranton and Claymont, the people don’t live off of the stock market."
f000945,4580.180,4590.800,"Just in the last three years, during this crisis, the billionaires in this country made, according to Wall Street, 700 billion more dollars."
n000267,4590.800,4591.120,(SILENCE)
f000946,4591.120,4593.080,700 billion more dollars.
n000268,4593.080,4593.440,(SILENCE)
f000947,4593.440,4595.280,Because that’s his only measure.
n000269,4595.280,4595.720,(SILENCE)
f000948,4595.720,4598.420,What happens to the ordinary people out there?
f000949,4598.420,4599.640,What happens to them?
f000950,4599.640,4601.400,Let’s talk about what’s happening on Capitol Hill.
f000951,4601.400,4603.520,"401(k)s. Kristen, 401(k)s are through the roof."
f000952,4603.520,4604.360,We’re going to move on.
f000953,4604.360,4606.360,People’s stock are through the roof.
f000954,4606.360,4606.680,All right.
f000955,4606.680,4608.000,And he doesn’t come from Scranton.
f000956,4608.000,4610.720,He lived there for a short period of time before he even knew it.
f000957,4610.720,4610.760,Okay.
f000958,4610.760,4612.880,We’re going to move on to the next question.
f000959,4612.880,4613.520,And he left.
f000960,4613.520,4615.520,And the people of Pennsylvania will show you that.
f000961,4615.520,4616.320,"Let me move on to my next question, gentlemen."
f000962,4616.320,4617.160,They understand.
f000963,4617.160,4619.920,"As of tonight, more than 12 million people are out of work."
n000270,4619.920,4620.280,(SILENCE)
f000964,4620.280,4626.200,"And as of tonight, 8 million more Americans have fallen into poverty, and more families are going hungry every day."
f000965,4626.200,4629.160,Those hit hardest are women and people of color.
f000966,4629.160,4632.040,They see Washington fighting over a relief bill.
n000271,4632.040,4632.400,(SILENCE)
f000967,4632.400,4635.280,"Mr. President, why haven’t you been able to get them the help they need?"
f000968,4635.280,4636.400,30 seconds here.
f000969,4636.400,4638.760,Because Nancy Pelosi doesn’t want to approve it.
f000970,4638.760,4639.320,I do.
f000971,4639.320,4640.080,But you’re the president.
n000272,4640.080,4640.520,(SILENCE)
f000972,4640.520,4641.080,I do.
f000973,4641.080,4645.920,"But I still have to get, unfortunately… That’s one of the reasons I think we’re going to take over the House, because of her."
f000974,4645.920,4652.560,Nancy Pelosi doesn’t want to approve anything because she’d love to have some victories on a date called November 3rd.
n000273,4652.560,4652.960,(SILENCE)
f000975,4652.960,4655.300,Nancy Pelosi does not want to approve it.
f000976,4655.300,4657.600,"We are ready, willing, and able to do something."
f000977,4657.600,4660.100,"Don’t forget, we’ve already approved three plans."
f000978,4660.100,4663.140,"And it’s gone through, including the Democrats, in all fairness."
f000979,4663.140,4664.520,"This one, she doesn’t want."
f000980,4664.520,4665.360,It’s near the election.
n000274,4665.360,4665.720,(SILENCE)
f000981,4665.720,4667.540,Because she thinks it helps her politically.
f000982,4667.540,4668.600,I think it hurts her politically.
f000983,4668.600,4670.680,"All right, Mr. Vice President-"
f000984,4670.680,4674.440,"By the way, as you know, the Republican leader in the United States Senate said he can’t pass it."
n000275,4674.440,4675.200,(SILENCE)
f000985,4675.200,4676.440,He will be able to pass it.
n000276,4676.440,4676.880,(SILENCE)
f000986,4676.880,4678.840,He does not have Republican votes.
f000987,4678.840,4680.960,Why isn’t he talking to his Republican friends?
f000988,4680.960,4683.280,"Let me follow up with you, Vice President Biden because-"
f000989,4683.280,4685.080,"If we made a deal, the Republicans will pass it."
f000990,4685.080,4687.960,Let me ask Vice President Biden a question.
f000991,4687.960,4689.320,You are the leader of the Democratic party.
f000992,4689.320,4691.720,Why have you not pushed the Democrats to get a deal for the American people?
f000993,4691.720,4693.120,"I have, and they have pushed it."
f000994,4693.120,4697.320,"Look, they passed this act all the way back in the beginning of the summer."
f000995,4697.320,4698.280,It’s not new.
n000277,4698.280,4698.760,(SILENCE)
f000996,4698.760,4699.880,It’s been out there.
n000278,4699.880,4700.320,(SILENCE)
f000997,4700.320,4702.640,This HEROES Act has been sitting there.
n000279,4702.640,4702.960,(SILENCE)
f000998,4702.960,4704.040,And look at what’s happening.
n000280,4704.040,4704.480,(SILENCE)
f000999,4704.480,4716.160,"When I was in charge of the recovery act with $800 billion, I was able to get $145 billion to local communities that have to balance their budgets and states that have to balance their budgets."
f001000,4716.160,4725.080,"And then they have to fire firefighters, teachers, first responders, law enforcement officers, so they could keep their cities and counties running."
f001001,4725.080,4726.720,He will not support that.
f001002,4726.720,4729.160,They have not done a thing for them.
f001003,4729.160,4731.280,"And Mitch McConnell said, “Let them go bankrupt."
n000281,4731.280,4731.880,(SILENCE)
f001004,4731.880,4733.840,Let them go bankrupt.” Come on.
n000282,4733.840,4734.280,(SILENCE)
f001005,4734.280,4735.720,What’s the matter with these guys?
f001006,4735.720,4744.600,"The bill that was passed in the House was a bailout of badly run, high crime, Democrat, all run by Democrat cities and states."
f001007,4744.600,4749.480,"It was a way of getting a lot of money, billions and billions of dollars, to these guys."
f001008,4749.480,4757.020,It was also a way of getting a lot of money from our people’s pockets to people that come into our country illegally.
f001009,4757.020,4759.400,We were going to take care of everything for them.
f001010,4759.400,4761.000,And I’d love to do that.
f001011,4761.000,4761.880,I’d love to help them.
f001012,4761.880,4765.920,"But what that does, everybody all over the world will start pouring into our country."
f001013,4765.920,4766.600,We can’t do it.
f001014,4766.600,4769.000,This was a way of taking care of them.
f001015,4769.000,4773.400,"This was a way of spending on things that had nothing to do with COVID, as per your question."
f001016,4773.400,4778.040,But it was really a big bailout for badly run Democrat cities and states.
f001017,4778.040,4778.520,All right.
f001018,4778.520,4778.960,I want to-
f001019,4778.960,4783.480,"By the way, if I get elected, I’m not going to… I’m running as a proud Democrat, but I’m going to be an American president."
f001020,4783.480,4785.440,I don’t see red states and blue states.
n000283,4785.440,4785.840,(SILENCE)
f001021,4785.840,4788.480,What I see is American United States.
f001022,4788.480,4792.400,"And folks, every single state out there finds themself in trouble."
f001023,4792.400,4801.520,"They’re going to start laying off, whether they’re red or blue, cops, firefighters, first responders, teachers, because they have to balance their budget."
f001024,4801.520,4803.080,And the founders were smart.
f001025,4803.080,4808.480,They allowed the federal government to deficit spend to compensate for the United States of America.
f001026,4808.480,4810.520,"I want to talk about the minimum wage, gentlemen."
f001027,4810.520,4816.660,"Mr. Vice President, we are talking a lot about struggling small businesses and business owners these days."
f001028,4816.660,4820.200,Do you think this is the right time to ask them to raise the minimum wage?
f001029,4820.200,4822.320,You of course support a $15 federal minimum wage.
f001030,4822.320,4826.800,"I do, because I think one of the things we’re going to have to do is we’re going to have to bail them out too."
n000284,4826.800,4827.360,(SILENCE)
f001031,4827.360,4831.080,"We should be bailing them out now, those small businesses."
f001032,4831.080,4832.800,You got one in six of them going under.
n000285,4832.800,4833.200,(SILENCE)
f001033,4833.200,4835.000,They’re not going to be able to make it back.
f001034,4835.000,4839.900,They passed a package that allows us to be able… They call it PPP.
f001035,4839.900,4853.240,"Money is supposed to go to help them do everything from organize how they can deal with their businesses being open safely, schools, how they can make classrooms smaller, how they can hire more teachers, how they can put ventilation systems in."
f001036,4853.240,4854.680,They need the help.
n000286,4854.680,4855.160,(SILENCE)
f001037,4855.160,4859.720,"The businesses, as well as the schools, need the help."
f001038,4859.720,4861.040,These guys will not help them.
n000287,4861.040,4861.520,(SILENCE)
f001039,4861.520,4862.480,It’s not giving them any of the money.
f001040,4862.480,4864.200,"We are going to move on to immigration, but I want to get-"
f001041,4864.200,4864.800,Excuse me.
f001042,4864.800,4866.000,One thing very quickly.
f001043,4866.000,4869.640,He said we have to help our small businesses by raising the minimum wage.
f001044,4869.640,4870.580,That’s not helping.
f001045,4870.580,4873.160,I think it should be a state option.
f001046,4873.160,4874.960,Alabama is different than New York.
n000288,4874.960,4875.440,(SILENCE)
f001047,4875.440,4877.460,New York is different from Vermont.
f001048,4877.460,4878.780,Every state is different.
f001049,4878.780,4879.960,It should be a state option.
f001050,4879.960,4881.360,You said very recently-
f001051,4881.360,4882.120,It’s very important.
n000289,4882.120,4882.440,(SILENCE)
f001052,4882.440,4883.720,We have to help our small businesses.
f001053,4883.720,4884.120,You said-
f001054,4884.120,4887.520,How are you helping your small businesses when you’re forcing wages?
f001055,4887.520,4893.000,"What’s going to happen, and what’s been proven to happen, is when you do that, these small businesses fire many of their employees."
f001056,4893.000,4893.520,You said very recently-
f001057,4893.520,4894.880,"Not true, by the way."
f001058,4894.880,4897.760,… you would consider raising the federal minimum wage to $15 an hour.
f001059,4897.760,4898.240,Say it.
f001060,4898.240,4898.440,Say it.
f001061,4898.440,4901.480,You said recently you would consider raising the federal minimum wage to $15 an hour.
f001062,4901.480,4905.320,"What I really like, and I would consider it to an extent-"
f001063,4905.320,4906.680,In a second administration?
f001064,4906.680,4908.880,But what I really like… In a second administration.
f001065,4908.880,4912.040,But not to a level that’s going to put all these businesses out of business.
f001066,4912.040,4913.400,It should be a state option.
f001067,4913.400,4913.680,"Look, I’ve lived-"
n000290,4913.680,4914.080,(SILENCE)
f001068,4914.080,4914.600,Every-
f001069,4914.600,4915.600,… in different places.
f001070,4915.600,4916.480,I know different places.
f001071,4916.480,4917.200,They’re all different.
n000291,4917.200,4917.720,(SILENCE)
f001072,4917.720,4920.560,"Some places, $ 15 is not so bad."
n000292,4920.560,4920.880,(SILENCE)
f001073,4920.880,4923.480,"In other places, other states, $15 would be ruinings."
f001074,4923.480,4924.980,"Okay, President Trump, thank you."
f001075,4924.980,4926.600,Quick response Vice President Biden.
n000293,4926.600,4926.960,(SILENCE)
f001076,4926.960,4930.760,"No one should work one job, be below poverty."
n000294,4930.760,4931.480,(SILENCE)
f001077,4931.480,4933.480,"People are making six, seven, eight bucks an hour."
f001078,4933.480,4939.000,These first responders we all clap for as they come down the street because they’ve allowed us to make it.
n000295,4939.000,4939.440,(SILENCE)
f001079,4939.440,4940.080,What’s happening?
n000296,4940.080,4940.440,(SILENCE)
f001080,4940.440,4943.200,They deserve a minimum wage of $15.
f001081,4943.200,4946.480,Anything below that puts you below the poverty level.
f001082,4946.480,4951.480,"And there is no evidence that when you raise the minimum wage, businesses go out of business."
f001083,4951.480,4952.960,That is simply not true.
