f000165,1238.800,1248.880,They used to brag back in Khrushchev's day that because of their greater patience and because of our greed for - for business deals that they would sooner or later get the better of us.
f000166,1248.880,1254.400,"Is it possible that despite some setbacks in the Middle East, they've proved their point?"
f000167,1254.400,1258.120,Our allies in France and Italy are now flirting with Communism.
n000088,1258.120,1259.000,(SILENCE)
f000168,1259.000,1262.360,We've recognized the permanent Communist regime in East Germany.
n000089,1262.360,1263.120,(SILENCE)
f000169,1263.120,1269.000,"We've virtually signed, in Helsinki, an agreement that the Russians have dominance in Eastern Europe."
n000090,1269.000,1270.200,(SILENCE)
f000170,1270.200,1273.920,We've bailed out Soviet agriculture with our huge grain sales.
n000091,1273.920,1274.440,(SILENCE)
f000171,1274.440,1283.720,"We've given them large loans, access to our best technology and if the Senate hadn't interfered with the Jackson Amendment, maybe we - you would've given them even larger loans."
n000092,1283.720,1284.640,(SILENCE)
f000172,1284.640,1286.880,Is that what you call a two-way street of traffic in Europe?
f000173,1286.880,1295.540,I believe that we have uh - negotiated with the Soviet Union since I've been president from a position of strength.
f000174,1295.540,1298.640,And let me cite several examples.
n000093,1298.640,1299.760,(SILENCE)
f000175,1299.760,1331.360,"Shortly after I became president in uh - December of 1974, I met with uh - General Secretary Brezhnev in Vladivostok and we agreed to a mutual cap on the ballistic missile launchers at a ceiling of twenty-four hundred - which means that the Soviet Union, if that becomes a permanent agreement, will have to make a reduction in their launchers that they now have or plan to have."
n000094,1331.360,1332.160,(SILENCE)
f000176,1332.160,1351.060,"I've negotiated at Vladivostok with uh - Mr. Brezhnev a limitation on the MIRVing of their ballistic missiles at a figure of thirteen-twenty, which is the first time that any president has achieved a cap either on launchers or on MIRVs."
f000177,1351.060,1354.300,It seems to me that we can go from there to uh - the uh - grain sales.
f000178,1354.300,1362.980,The grain sales have been a benefit to American agriculture.
f000179,1362.980,1391.260,"We have achieved a five and three quarter year uh - sale of a minimum six million metric tons, which means that they have already bought about four million metric tons this year and are bound to buy another two million metric tons to take the grain and corn and wheat that the American farmers have produced in order to uh - have full production."
f000180,1391.260,1403.580,And these grain sales to the Soviet Union have helped us tremendously in meeting the costs of the additional oil and - the oil that we have bought from overseas.
f000181,1403.580,1408.800,"If we turn to Helsinki - I'm glad you raised it, Mr. uh - Frankel."
n000095,1408.800,1410.040,(SILENCE)
f000182,1410.040,1440.260,"In the case of Helsinki, thirty-five nations signed an agreement, including the secretary of state for the Vatican - I can't under any circumstances believe that the - His Holiness, the Pope would agree by signing that agreement that the thirty-five nations have turned over to the Warsaw Pact nations the domination of the - Eastern Europe."
f000183,1440.260,1441.680,It just isn't true.
n000096,1441.680,1442.360,(SILENCE)
f000184,1442.360,1448.060,"And if Mr. Carter alleges that His Holiness by signing that has done it, he is totally inaccurate."
n000097,1448.060,1448.960,(SILENCE)
f000185,1448.960,1451.400,"Now, what has been accomplished by the Helsinki agreement?"
n000098,1451.400,1451.880,(SILENCE)
f000186,1451.880,1461.560,"Number one, we have an agreement where they notify us and we notify them of any uh - military maneuvers that are to be be undertaken."
f000187,1461.560,1462.320,They have done it.
f000188,1462.320,1472.360,"In both cases where they've done so, there is no Soviet domination of Eastern Europe and there never will be under a Ford administration."
n000099,1472.360,1473.640,(SILENCE)
f000189,1473.640,1474.080,Governor Carter?
n000100,1474.080,1475.560,(SILENCE)
f000190,1475.560,1496.640,"I'm sorry, I - could I just follow - did I understand you to say, sir, that the Russians are not using Eastern Europe as their own sphere of influence in occupying mo- most of the countries there and in - and making sure with their troops that it's a - that it's a Communist zone, whereas on our side of the line the Italians and the French are still flirting with the possibility of Communism?"
n000101,1496.640,1497.440,(SILENCE)
f000191,1497.440,1503.480,"I don't believe, uh - Mr. Frankel that uh - the Yugoslavians consider themselves dominated by the Soviet Union."
f000192,1503.480,1507.880,I don't believe that the Rumanians consider themselves dominated by the Soviet Union.
n000102,1507.880,1508.400,(SILENCE)
f000193,1508.400,1514.720,I don't believe that the Poles consider themselves dominated by the Soviet Union.
f000194,1514.720,1529.940,"Each of those countries is independent, autonomous: it has its own territorial integrity and the United States does not concede that those countries are under the domination of the Soviet Union."
f000195,1529.940,1548.120,"As a matter of fact, I visited Poland, Yugoslavia and Rumania to make certain that the people of those countries understood that the president of the United States and the people of the United are dedicated to their independence, their autonomy and their freedom."
f000196,1548.120,1550.680,"Governor Carter, may I have your response?"
f000197,1550.680,1558.060,"(chuckle) Well, in the first place, I'm not criticizing His Holiness the Pope."
f000198,1558.060,1565.720,I was talking about Mr. Ford.
f000199,1565.720,1569.760,The uh - fact is that secrecy has surrounded the decisions made by the Ford administration.
f000200,1569.760,1583.840,"In the case of the Helsinki agreement - it may have been a good agreement at the beginning, but we have failed to enforce the so-called basket three part, which insures the right of people to migrate, to join their families, to be free, to speak out."
n000103,1583.840,1584.400,(SILENCE)
f000201,1584.400,1591.620,The Soviet Union is still jamming Radio Free Europe - Radio - uh- uh - Radio Free Europe is being jammed.
f000202,1591.620,1604.560,"We've also seen a very serious uh - problem with the so-called Sonnenfeldt document, which apparently Mr. Ford has just endorsed, which said that there's an organic linkage between the Eastern European countries and the Soviet Union."
n000104,1604.560,1605.160,(SILENCE)
f000203,1605.160,1620.680,And I would like to see Mr. Ford convince the Polish-Americans and the Czech-Americans and the Hungarian-Americans in this country that those countries don't live under the domination and supervision of the Soviet Union behind the Iron - uh - Curtain.
f000204,1620.680,1623.980,We also have seen Mr. Ford exclude himself from access to the public.
f000205,1623.980,1627.820,He hasn't had a tough cross-examination-type press conference in over thirty days.
f000206,1627.820,1630.720,One press conference he had without sound.
f000207,1630.720,1631.880,He's also shown a weakness in yielding to pressure.
n000105,1631.880,1632.760,(SILENCE)
f000208,1632.760,1643.040,"The Soviet Union, for instance, put pressure on Mr. Ford and he refused to see a symbol of human freedom recognized around the world, Aleksandr Solzhenitsyn."
n000106,1643.040,1644.080,(SILENCE)
f000209,1644.080,1659.800,"The Arabs have put pressure on Mr. Ford, and he's yielded, and has permitted a boycott by the Arab countries of American businesses who trade with Israel, or who have American Jews owning or taking part in the management of American - companies."
n000107,1659.800,1660.960,(SILENCE)
f000210,1660.960,1667.720,His own secretary of commerce had to be subpoenaed by the Congress to reveal the names of businesses who were subject to this boycott.
f000211,1667.720,1668.160,They didn't volunteer the information.
n000108,1668.160,1668.920,(SILENCE)
f000212,1668.920,1671.400,He had to be subpoenaed.
f000213,1671.400,1683.920,"And the last thing I'd like to say is this: This grain deal with the Soviet Union in '72 was terrible, and Mr. Ford made up for it with three embargoes, one against our own ally in Japan."
f000214,1683.920,1688.140,"That's not the way to run our foreign policy, including international trade."
f000215,1688.140,1690.240,"Mr. Trewhitt, a question for Governor Carter."
n000109,1690.240,1691.120,(SILENCE)
f000216,1691.120,1697.240,"Governor, I'd like to pick up on that point, actually, and on your appeal for a greater measure of American idealism in foreign affairs."
n000110,1697.240,1698.160,(SILENCE)
f000217,1698.160,1704.160,"Foreign affairs come home to the American public pretty much in such issues as oil embargoes and grain sales, that sort of thing."
n000111,1704.160,1705.480,(SILENCE)
f000218,1705.480,1715.640,"Would you be willing to - to risk an oil embargo in order to promote human rights in Iran and Saudi Arabia, withhold arms from Saudi Arabia for the same purpose?"
n000112,1715.640,1716.160,(SILENCE)
f000219,1716.160,1725.200,"Uh - or uh - I think you - matter of fact, you've perhaps answered this final part, but would you withhold grain from the Soviet Union in order to promote civil rights in the - in the Serviette Union?"
n000113,1725.200,1725.800,(SILENCE)
f000220,1725.800,1731.800,I would never single out food as a trade embargo item.
n000114,1731.800,1732.640,(SILENCE)
f000221,1732.640,1739.620,"If I ever decided to impose an embargo because of a crisis in international relationships, it would include all shipments of all equipment."
f000222,1739.620,1755.840,"For instance, if the Arab countries ever again declare an embargo against our nation on oil I would consider that not a military but an economic declaration of war, and I would respond instantly and in kind."
f000223,1755.840,1764.920,"I would not ship that Arab country anything - no weapons, no spare parts for weapons, no oil-drilling rigs, no oil pipe, no nothing."
n000115,1764.920,1765.640,(SILENCE)
f000224,1765.640,1766.720,I wouldn't single out just food.
n000116,1766.720,1767.760,(SILENCE)
f000225,1767.760,1778.720,"Another thing that I'd like to say is this: In our international trade, as I said in my op- opening statement, we have become the arms merchant of the world."
f000226,1778.720,1788.320,"When this Republican administration came into office we were shipping about $1 billion worth of arms overseas, now ten to twelve billion dollars worth of arms overseas to countries that quite often use these weapons to fight each other."
n000117,1788.320,1789.400,(SILENCE)
f000227,1789.400,1792.680,"The shift in emphasis has been very disturbing to me, speaking about the Middle East."
n000118,1792.680,1793.760,(SILENCE)
f000228,1793.760,1801.960,Under the last Democratic administration 60 percent of all weapons that went into the Middle East were for Israel.
n000119,1801.960,1803.160,(SILENCE)
f000229,1803.160,1806.460,Nowadays - 75 percent were for Israel before.
f000230,1806.460,1811.360,"Now 60 percent go to the Arab countries, and this does not include Iran."
f000231,1811.360,1818.520,"If you include Iran, our present shipment of weapons to the Middle East, only 20 percent goes to Israel."
f000232,1818.520,1834.400,"This is a deviation from idealism; it's a deviation from a commitment to our major ally in the Middle East, which is Israel; it's a yielding to economic pressure on the part of the Arabs on the oil issue; and it's also a tremendous indication that under the Ford administration we have not addressed the energy policy adequately."
f000233,1834.400,1839.640,We still have no comprehensive energy policy in this country.
n000120,1839.640,1840.120,(SILENCE)
f000234,1840.120,1844.060,And it's an overall sign of weakness.
f000235,1844.060,1857.920,"When we are weak at home economically - high unemployment, high inflation, a confused government, a wasteful defense establishment, this encourages the kind of pressure that's been put on us successfully."
n000121,1857.920,1858.720,(SILENCE)
f000236,1858.720,1864.960,"It would've been inconceivable ten - fifteen years ago, for us to be brought to our knees with an Arab oil embargo."
n000122,1864.960,1866.240,(SILENCE)
f000237,1866.240,1874.960,But it was done three years ago and they're still putting pressure on us from the Arab countries to our discredit around the world.
f000238,1874.960,1878.200,"These are the weaknesses that I see, and I believe it's not just a matter of idealism."
f000239,1878.200,1880.000,It's a matter of being tough.
n000123,1880.000,1880.800,(SILENCE)
f000240,1880.800,1881.880,It's a matter of being strong.
n000124,1881.880,1882.360,(SILENCE)
f000241,1882.360,1883.160,It's a matter of being consistent.
n000125,1883.160,1883.880,(SILENCE)
f000242,1883.880,1895.920,"Our priorities ought to be first of all to meet our own military needs, secondly to meet the needs of our allies and friends, and only then should we ship military equipment to foreign countries."
f000243,1895.920,1900.240,"As a matter of fact, Iran is gonna get eighty F-14s before we even meet our own Air Force orders for F-l4s."
n000126,1900.240,1900.960,(SILENCE)
f000244,1900.960,1909.640,And the shipment of Spruance-class destroyers to Iran are much more highly sophisticated than the Spruance-class destroyers that are present being delivered to our own Navy.
n000127,1909.640,1910.000,(SILENCE)
f000245,1910.000,1911.840,This is ridiculous and it ought to be changed.
f000246,1911.840,1914.600,"Governor, let me pursue that if I may."
f000247,1914.600,1927.940,"If I understand you correctly you would in fact to use my examples, withhold arms from Iran and Saudi Arabia even if the risk was an oil embargo and if they should be securing those arms from somewhere else, and then if the embargo came, then you'd respond in kind."
f000248,1927.940,1929.200,Do I have it correctly?
n000128,1929.200,1929.640,(SILENCE)
f000249,1929.640,1944.000,"If - Iran is not an Arab country, as you know, it is a Moslem country - but if Saudi Arabia should declare an oil embargo against us, then I would consider that an economic declaration of war."
f000250,1944.000,1949.040,And I would make sure that the uh - Saudis understood this ahead of time so there would be no doubt in their mind.
n000129,1949.040,1949.400,(SILENCE)
f000251,1949.400,1957.420,I think under those circumstances they would refrain from pushing us to our knees as they did in 1973 with their previous oil embargo.
n000130,1957.420,1958.800,(SILENCE)
f000252,1958.800,1959.440,President Ford?
n000131,1959.440,1961.600,(SILENCE)
f000253,1961.600,1974.760,Governor Carter uh - apparently doesn't realize that since I've been president we have sold to the Israelis over $4 billion in military hardware.
f000254,1974.760,1988.880,We have made available to the Israelis over 45 percent of the total economic and military aid since the establishment of Israel twenty-seven years ago.
n000132,1988.880,1989.440,(SILENCE)
f000255,1989.440,2000.700,"So the Ford administration has done a good job in helping our good ally, Israel, and we're dedicated to the survival and security of Israel."
f000256,2000.700,2009.400,I believe that Governor Carter doesn't realize the need and necessity for arms sales to Iran.
f000257,2009.400,2011.640,He indicates he would not make those.
f000258,2011.640,2016.400,Iran is bordered very extensively by the Soviet Union.
n000133,2016.400,2017.040,(SILENCE)
f000259,2017.040,2020.280,Iran has Iraq as one of its neighbors.
n000134,2020.280,2021.280,(SILENCE)
f000260,2021.280,2030.760,"The Soviet Union and the Communist-dominated government of Iraq are neighbors of Iran, and Iran is an ally of the United States."
n000135,2030.760,2031.640,(SILENCE)
f000261,2031.640,2041.400,"It's my strong feeling that we ought to sell arms to Iran for its own national security, and as an ally - a strong ally of the United States."
n000136,2041.400,2042.080,(SILENCE)
f000262,2042.080,2060.780,"The history of our relationship with Iran goes back to the days of President Truman when he decided that it was vitally necessary for our own security as well as that of Iran, that we should help that country, and Iran has been a good ally."
f000263,2060.780,2066.640,"In 1973 when there was an oil embargo, Iran did not participate."
f000264,2066.640,2070.400,Iran continued to sell oil to the United States.
n000137,2070.400,2071.040,(SILENCE)
f000265,2071.040,2081.460,"I believe that it's in our interest and in the interest of Israel and Iran, and Saudi Arabia, for the United States to sell arms to those countries."
n000138,2081.460,2082.160,(SILENCE)
f000266,2082.160,2084.440,It's for their security as well as ours.
n000139,2084.440,2085.120,(SILENCE)
f000267,2085.120,2087.580,"Mr. Valeriani, a question for President Ford."
n000140,2087.580,2088.480,(SILENCE)
f000268,2088.480,2092.880,"Mr. President, the policy of your administration is to normalize relations with mainland China."
n000141,2092.880,2093.600,(SILENCE)
f000269,2093.600,2100.440,And that means establishing at some point full diplomatic relations and obviously doing something about the mutual defense treaty with Taiwan.
n000142,2100.440,2101.280,(SILENCE)
f000270,2101.280,2109.240,"If you are elected, will you move to establish full diplomatic relations with Peking, and will you abrogate the mutual defense treaty with Taiwan?"
n000143,2109.240,2109.640,(SILENCE)
f000271,2109.640,2118.080,"And, as a corollary, would you provide mainland China with military equipment if the Chinese were to ask for it?"
f000272,2118.080,2133.100,"Our relationship with the People's Republic of China is based upon the Shanghai Communique, of 1972, and that communique, calls for the normalization of relations between the United States and the People's Republic."
n000144,2133.100,2133.880,(SILENCE)
f000273,2133.880,2136.460,It doesn't set a times schedule.
f000274,2136.460,2151.360,It doesn't uh - make a determination as to how uh - that relationship should be achieved in relationship to our current uhh - diplomatic recognition and obligations to the Taiwanese Government.
n000145,2151.360,2152.080,(SILENCE)
f000275,2152.080,2164.440,"The Shanghai Communique, does say that the differences between the People's Republic on the one hand and Taiwan on the other shall be settled by peaceful means."
n000146,2164.440,2165.560,(SILENCE)
f000276,2165.560,2192.100,"The net result is this administration, and during my time as the president for the next four years, we will continue to move for normalization of relations in the traditional sense, and we will insist that the disputes between Taiwan and the People's Republic be settled peacefully, as was agreed in the Shanghai Communique, of 1972."
f000277,2192.100,2201.280,"The Ford administration will not let down, will not eliminate or forget our obligation to the people of Taiwan."
n000147,2201.280,2202.120,(SILENCE)
f000278,2202.120,2207.700,"We feel that there must be a continued obligation to the people, the some nineteen or twenty million people in Taiwan."
f000279,2207.700,2215.340,"And as we move during the next four years, those will be the policies of this administration."
f000280,2215.340,2219.840,"And sir, the military equipment for the mainland Chinese?"
f000281,2219.840,2231.600,"There is no policy of this government to give to the People's Republic, or to sell to the People's Republic of China, military equipment."
n000148,2231.600,2232.280,(SILENCE)
f000282,2232.280,2249.880,"I do not believe that we, the United States, should sell, give or otherwise transfer military hardware to the People's Republic of China, or any other Communist nation, such as the Soviet Union and the like."
n000149,2249.880,2251.240,(SILENCE)
f000283,2251.240,2251.840,Governor Carter.
n000150,2251.840,2253.960,(SILENCE)
f000284,2253.960,2265.540,"Well, I'd like to go back just one moment to the previous question, where uh - Mr. Ford, I think, confused the issue by trying to say that we are shipping Israel 40 percent of our aid."
f000285,2265.540,2276.600,"As a matter of fact, during this current year uh we are shipping Iran, or have contracted to ship to Iran, about seven and a half billion dollars worth of arms and also to Saudi Arabia, about seven and a half billion dollars worth of arms."
n000151,2276.600,2277.360,(SILENCE)
f000286,2277.360,2287.220,"Also in 1975, we almost brought Israel to their knees after the uh - Yom Kippur War by the so-called reassessment of our relationship to Israel."
f000287,2287.220,2292.200,We in effect tried to make Israel the scapegoat for the problems in the Middle East.
n000152,2292.200,2292.720,(SILENCE)
f000288,2292.720,2300.100,And this weakened our relationships with Israel a great deal and put a cloud on the total commitment that our people feel toward the Israelis.
f000289,2300.100,2304.840,"There ought to be a clear, unequivocal commitment without change to Israel."
f000290,2304.840,2315.960,In the Far East I think we need to continue to be uh - strong and uh - I would certainly uh - pursue the uh - normalization of uh - relationships with the People's Republic of China.
n000153,2315.960,2316.680,(SILENCE)
f000291,2316.680,2326.400,"We opened a great opportunity in l972, which has pretty well been frittered - frit- frittered away under Mr. Ford, that ought to be a constant uh - inclination toward - uh - toward friendship."
f000292,2326.400,2334.920,But I would never let that friendship with the People's Republic of China stand in the way of the preservation of the independence and freedom of the people on Taiwan.
f000293,2334.920,2338.760,"Mr. Frankel, a question for Governor Carter."
n000154,2338.760,2339.760,(SILENCE)
f000294,2339.760,2346.680,"Governor, we always seem in our elections, and maybe in between too, to argue about uh - who can be tougher in the world."
n000155,2346.680,2347.360,(SILENCE)
f000295,2347.360,2360.240,"Give or take a - a few billion dollars, give or take one weapons systems, our leading politicians, and I think you, too, gentlemen, seem to settle roughly on the same strategy in the world at roughly the same Pentagon budget cost."
n000156,2360.240,2361.520,(SILENCE)
f000296,2361.520,2381.080,"How bad do things have to get in our own economy, or how much backwardness and hunger would it take in the world to persuade you that our national security and our survival required very drastic cutbacks in arms spending and dramatic new efforts in other directions?"
n000157,2381.080,2383.160,(SILENCE)
f000297,2383.160,2399.880,"Well, always in the past we've had an ability to have a strong defense and also have - to have a strong uh - domestic economy, and also to be strong in our reputation and influence within the community of nations."
n000158,2399.880,2401.200,(SILENCE)
f000298,2401.200,2405.600,These uh - characteristics of our country have been endangered under Mr. Ford.
n000159,2405.600,2406.920,(SILENCE)
f000299,2406.920,2414.800,We're no longer respected in a showdown vote in the United Nations or in - in any other international council we're lucky to get 20 percent of the other nations to vote with us.
n000160,2414.800,2415.680,(SILENCE)
f000300,2415.680,2418.320,Our allies feel that we've neglected them.
f000301,2418.320,2423.280,The so-called Nixon shock against Japan had weakened our relationships there.
f000302,2423.280,2432.200,"Under this administration we've also had an inclination to keep separate the European countries, thinking that if they are separate, then we can dominate them and proceed with our secret, Lone Ranger-type diplomatic efforts."
f000303,2432.200,2442.000,"I would uh - also like to point out that we, in this country, have let our economy go down the drain."
n000161,2442.000,2443.400,(SILENCE)
f000304,2443.400,2446.600,The worst inflation since the Great Depression.
n000162,2446.600,2447.720,(SILENCE)
f000305,2447.720,2451.940,The highest unemployment of any developed nation of the world.
f000306,2451.940,2456.200,"We have a higher unemployment rate in this country than Great Britain, and West Germany."
n000163,2456.200,2456.920,(SILENCE)
f000307,2456.920,2465.080,Our unemployment rate is twice as high as it is in Italy; it's three or four times as high as it is - as it is in Japan.
f000308,2465.080,2468.240,And that terrible circumstance in this country is exported overseas.
f000309,2468.240,2475.860,We comprise about 30 percent of the world's economic trade power influence.
f000310,2475.860,2480.840,And when we're weak at home - weaker than all our allies - that weakness weakens the whole free world.
f000311,2480.840,2485.120,So strong economy is very important.
n000164,2485.120,2485.800,(SILENCE)
f000312,2485.800,2493.140,Another thing that we need to do is to reestablish the good relationships that we ought to have between the United States and our natural allies and friends.
f000313,2493.140,2494.800,They have felt neglected.
f000314,2494.800,2509.960,"And using that base of strength, and using the idealism, the honesty, the predictability, the commitment, the integrity of our own country, that's where our strength lies."
n000165,2509.960,2511.080,(SILENCE)
f000315,2511.080,2513.560,And that would permit us to deal with the developing nations in a position of strength.
f000316,2513.560,2524.680,"Under this administration we've had a continuation of the so-called balance of power politics, where everything is looked on as a struggle between us on the one side, the Soviet Union on the other."
f000317,2524.680,2528.480,Our allies - the smaller countries get trampled in the rush.
n000166,2528.480,2528.840,(SILENCE)
